Reference	ID	Tags	Quote	Occurrence	Question	Response
10:13	o3hs				What did King Solomon give to the queen of Sheba?	King Solomon gave to the queen of Sheba everything she asked for.
10:14	inki				What was the weight of the gold that came to King Solomon in one year?	The weight of the gold that came to King Solomon in one year was 666 talents.
10:15	petr				Who brought gold and silver to Solomon?	The kings of Arabia and governors in the country brought gold and silver to Solomon.
10:16	f8jy				How many large shields of beaten gold did King Solomon make?	King Solomon made two hundred shields of beaten gold.
10:17	vh3x				Where did King Solomon put three hundred shields of beaten gold?	King Solomon put three hundred shields of beaten gold into the Palace of the Forest of Lebanon.
10:18	niq4				What did the king make out of ivory and finest gold?	The king made a great throne of ivory and the finest gold.
10:19	holn				What was standing beside the armrests of the throne that the king made?	Two lions were standing beside the armrests of the throne that the king made.
10:20	d2k3				What stood on the side of the six steps at the throne?	Twelve lions were standing on the sides of the six steps at the throne.
10:21	o70u				Of what were the drinking cups in the Palace of the Forest of Lebanon made?	The drinking cups in the Palace of the Forest of Lebanon were made of pure gold.
10:22	z8e7				What did the king’s ships bring every three years?	Every three years, the king’s ships brought gold, silver, ivory, apes, and baboons.
10:24	l7cu				Why did all the earth seek out Solomon?	All the earth sought out Solomon to hear the wisdom God put in his heart.
10:25	vqfw				What tribute did Solomon’s visitors bring to him?	Those who visited brought tribute such as gold, silver, clothing, armor, and spices.
10:26	tcix				Where did Solomon station his chariots and horsemen?	Solomon stationed his chariots and horsemen in the chariot cities and in Jerusalem.
10:27	x02t				What did the king do with cedar wood?	The king made cedar wood become as abundant as the sycamore fig trees in the lowlands.
10:28	jp4f				From where were Solomon’s horses brought?	Solomon’s horses were brought from Egypt and Cilicia.
10:29	bgbi				What was the purchase price of each chariot Solomon owned?	The chariots were purchased for six hundred shekels of silver each.
11:1	cve2				Whom did King Solomon love?	King Solomon loved many foreign women.
11:2	igga				What did Yahweh command about marrying women from foreign nations?	Yahweh commanded Israel not to marry women from foreign nations.
11:3	t0sz				What did Solomon’s wives do to his heart?	Solomon’s wives turned his heart away.
11:4	imm7				How was David’s heart toward Yahweh?	David’s heart was fully surrendered to Yahweh his God.
11:5	frj4				What did Solomon follow?	Solomon followed Ashtoreth the goddess of the Sidonians and Milcom of the Ammonites.
11:6	tb8m				What did Solomon do in the sight of Yahweh?	Solomon did that which was evil in the sight of Yahweh.
11:7	pr7w				What did Solomon build for Chemosh?	Solomon built a shrine for Chemosh, the idol of Moab.
11:8	wkf2				What did Solomon do at the shrines of his foreign wives?	Solomon burned incense and sacrificed to their gods at the shrines.
11:9	u85g				How many times did Yahweh appear to Solomon?	Yahweh appeared twice to Solomon.
11:10	lf0g				What did Yahweh command Solomon?	Yahweh commanded Solomon to not go after foreign gods.
11:11	r8e0				What did Yahweh tell Solomon he would do because of the foreign gods?	Yahweh told Solomon he would tear the kingdom from him and give it to his servant.
11:13	m1ss				How many tribes did Yahweh promise to give to Solomon’s son?	Yahweh promised to give one tribe to Solomon’s son.
11:14	n7jv				Whom did Yahweh raise up as an adversary to Solomon?	Yahweh raised up Hadad the Edomite as an adversary to Solomon.
11:15	efrz				Who went up to bury the dead who had been killed in Edom?	Joab the captain of the army went up to bury the dead who were killed in Edom.
11:16	ks69				How long did Joab and Israel remain in Edom?	Joab and Israel remained in Edom six months.
11:17	kpi3				To where was Hadad taken?	Hadad was taken to Egypt.
11:19	pkvp				Whom did Pharaoh give as a wife to Hadad?	Pharaoh gave to Hadad the sister of Queen Tahpenes as his wife.
11:20	oscm				What was the name of Hadad’s son?	Hadad’s son was named Genubath.
11:21	qipw				What did Hadad ask of Pharaoh?	Hadad asked Pharaoh if he might depart and go to his own country.
11:23	woxj				What was the name of another adversary that God raised up against Solomon?	God raised up another adversary to Solomon named Rezon son of Eliada.
11:24	s98e				To where did Rezon’s men travel?	Rezon’s men went to Damascus and lived there.
11:25	rxv1				How long was Rezon an enemy of Israel?	Rezon was an enemy of Israel all of the days of Solomon.
11:26	k9d0				Who lifted up his hand against the king?	Jeroboam the son of Nebat lifted up his hand against the king.
11:27	xpiv				Why did Jeroboam lift up his hand against the king?	Jeroboam the son of Nebat lifted up his hand against the king because he built the Millo and repaired the wall of the city of David.
11:28	w8ex				What did Solomon give Jeroboam command over?	Solomon gave Jeroboam command over all the labor of the house of Joseph.
11:29	q2x3				Who found Jeroboam on the road as he went out of Jerusalem?	The prophet Ahijah found Jeroboam on the road as he went out of Jerusalem.
11:30	q489				What did Ahijah do to Jeroboam’s new garment?	Ahijah grabbed Jeroboam’s new garment and tore it into twelve pieces.
11:31	r57k				What did Yahweh say about Solomon’s kingdom?	Yahweh said that He would tear the kingdom out of Solomon’s hand.
11:32	nxwt				How many tribes would Solomon keep?	Solomon would keep one tribe for the sake of David.
11:34	nw7d				How long did Yahweh make Solomon to be ruler?	Yahweh made Solomon ruler all the days of his life.
11:36	r7bt				In which city did Yahweh choose to put his name?	Yahweh chose to put his name in the city of Jerusalem.
11:38	lb9e				What did Yahweh promise to do for Jeroboam if he walked in his ways?	Yahweh promised to give Jeroboam a sure house and also give Israel to him if he walked in his ways.
11:40	osrj				What did Solomon try to do to Jeroboam?	Solomon tried to kill Jeroboam.
11:42	wb56				How long did Solomon reign in Jerusalem?	Solomon reigned in Jerusalem for forty years.
11:43	b752				Who became king in Solomon’s place?	Rehoboam became king in Solomon’s place.
12:1	u2lc				Why did Rehoboam go to Shechem?	Rehoboam went to Shechem because all Israel was coming there to make him king.
12:3	gayr				Who came with the assembly of Israel to speak to Rehoboam?	Jeroboam the son of Nebat came with the assembly of Israel to speak to Rehoboam.
12:4	yij6				What did Israel ask of Rehoboam?	All Israel asked that Rehoboam would lighten the heavy yoke his father had put on them.
12:5	onna				For how many days did Rehoboam send the people away?	Rehoboam sent the people away for three days.
12:6	ux09				With whom did Rehoboam consult?	Rehoboam consulted with the older men who stood before Solomon his father.
12:7	gq0l				What did the older men say to Rehoboam?	The older men said that Rehoboam should say good words to the people of Israel.
12:8	eoie				What did Rehoboam do with the advice the older men gave him?	Rehoboam ignored the advice of the older men.
12:10	x9ks				What did the younger men tell Rehoboam to say to the people?	The younger men told Rehoboam to say, “My little finger is thicker than my father’s waist.”
12:11	i9rk				What did Rehoboam say he would use to punish the people?	Rehoboam said he would use scorpions to punish the people.
12:12	jjvv				What had the king instructed the people to do?	The king had instructed the people to come back on the third day.
12:13	ot6b				How did the king answer the people?	The king answered the people roughly.
12:14	bgqj				What did the king say he would do with the yoke on the people?	The king said he would add to the yoke on the people.
12:15	a8fh				Who brought about these events?	These events were brought about by Yahweh.
12:16	h2pz				What did all Israel say when they saw that the king did not listen to them?	All Israel said, “We have no inheritance in the son of Jesse; flee to your tents.”
12:17	qm0g				Over what people did Rehoboam become king?	Rehoboam became king over the people of Israel who lived in the cities of Judah.
12:18	wdr3				What did Israel do to Adoram?	All Israel stoned Adoram to death with stones.
12:20	dv3y				Who followed the family of David?	Only the tribe of Judah followed the family of David.
12:21	uduw				Why did Rehoboam assemble the house of Judah in Jerusalem?	Rehoboam assembled the house of Judah to fight against the house of Israel.
12:22	q4dj				To whom did the word of God come?	The word of God came to Shemaiah the man of God.
12:24	n3fi				What did Yahweh say?	Yahweh said, “You must not attack or fight against your brothers the people of Israel.”
12:25	dktx				Where did Jerohoam build Shechem?	Jeroboam built Shechem in the hill country of Ephraim.
12:26	bzrt				What did Jeroboam think in his heart?	Jeroboam thought in his heart, “Now the kingdom will return to the house of David.”
12:27	jny5				What did Jeroboam say about the people offering sacrifices in the temple of Yahweh?	Jeroboam said, “If these people offer sacrifices in the temple of Yahweh, they will kill me and return to Rehoboam king of Judah.”
12:28	v04v				What did King Jeroboam make?	King Jeroboam made two calves of gold.
12:29	l7jk				Where did Jeroboam set up the two calves of gold?	King Jeroboam set up one calf in Bethel and one in Dan.
12:31	totd				What people did Jeroboam make into priests?	Jeroboam made priests of the people who were not among the sons of Levi.
12:32	ch1y				What did Jeroboam do at Bethel?	Jeroboam ordained a feast at Bethel.
12:33	iaf5				What did Jeroboam do at the altar in Bethel?	Jeroboam went up to the altar to burn incense.
13:1	mjwk				Who came out of Judah by the word of Yahweh?	A man of God came out of Judah by the word of Yahweh.
13:2	v90g				What did the man of God cry out against the altar at Bethel?	The man of God cried out against the altar, “On you they will burn men’s bones.”
13:3	r8cc				What sign did the man of God give about the altar?	The man of God gave a sign saying, “The altar will be split apart and the ashes on it will be poured out.”
13:4	mgvf				What happened to Jeroboam’s hand when he reached out from the altar?	When Jeroboam reached out from the altar, his hand was dried up so he could not draw it back to himself.
13:5	pnwu				What happened to the altar?	The altar was split apart and the ashes poured out as the man of God described.
13:6	kcyl				What happened when the man of God prayed to Yahweh about Jeroboam’s hand?	When the man of God prayed to Yahweh, the king’s hand was restored and became as it was before.
13:7	uut5				What did the king say to the man of God?	The king said to the man of God, “Come home with me and I will give you a reward.”
13:8	fybt				What did the man of God say to the king?	The man of God said to the king, “I will not go with you.”
13:10	jwr4				What did the man of God do after speaking with the king?	After speaking with the king, the man of God returned home by a different way than he came to Bethel.
13:11	nu0l				Where did an old prophet live?	An old prophet lived in Bethel.
13:12	gfxe				Who saw the way that the man of God had gone from Bethel?	The old prophet’s sons saw the way that the man of God went to Bethel.
13:13	hu9i				Where did the old prophet find the man of God?	The old prophet found the man of God sitting under an oak tree.
13:15	nntp				What did the old prophet say to the man of God?	The old prophet said to the man of God, “Come home with me and eat food.”
13:16	fvyu				What was the man of God’s answer to the old prophet?	The man of God answered, “I may not return with you or go in with you.”
13:17	sqkb				What was the old prophet’s answer to the man of God?	The old prophet was lying to the man of God and answered, “An angel spoke by the word of Yahweh saying ‘Bring him back to your house.’”
13:19	jcc2				Where did the man of God go after the old prophet lied to him?	The man of God went back and ate food and drank water in his house.
13:20	sy7m				What came to the old prophet as they sat at the table?	The word of Yahweh came to the old prophet as they sat at the table.
13:22	tl2t				What did the word of Yahweh say to the man of God?	The word of Yahweh said, “Because you came back and ate food and drank water your body will not be buried in the tomb of your fathers.”
13:23	qq5f				What did the old prophet do after they ate?	After they ate, the old prophet saddled the man of God’s donkey for him.
13:24	trr6				What happened after the man of God had gone?	After the man of God had gone, a lion met him on the road and killed him.
13:25	kdtn				What did men do when they saw the body of the man of God lying on the road?	When men saw the man of God’s body lying on the road, they came back and told it in the city of the old prophet.
13:26	nc1x				What was the old prophet’s answer to the men?	The old prophet answered, “This is the man of God who was disobedient to the word of Yahweh.”
13:28	cj4m				What did the old prophet do after hearing the men?	The old prophet spoke to his sons to saddle his donkey and he went and found the body left in the road.
13:30	w4ws				What did the old prophet do with the body of the man of God?	The old prophet took up the body of the man of God and buried him in his own grave.
13:31	wmh3				What did the old prophet say to his sons about his own burial?	The old prophet said to his sons, “When I am dead, bury me in the tomb in which the man of God is buried.”
13:34	o8ae				What thing became sin to the family of Jeroboam and caused it to be cut off from the face of the earth?	Jeroboam did not turn away from evil and consecrated as priests whomever he would; this thing became sin to the family of Jeroboam.
14:1	v7gk				What happened to Abijah the son of Jeroboam?	Abijah the son of Jeroboam fell sick.
14:2	gzs5				What did Jeroboam ask his wife to do?	Jeroboam asked his wife to disguise herself and go to the prophet Ahijah in Shiloh.
14:3	iwpc				Why did Jeroboam ask his wife to go to the prophet Ahijah?	Jeroboam asked his wife to go to the prophet Ahijah to find out what would happen to his sick son.
14:4	v80c				What was wrong with Ahijah’s eyes?	Since Ahijah was old he was blind and his eyes could not see.
14:5	fnrd				Who told Ahijah, “The wife of Jeroboam is coming to see you.”?	Yahweh told Ahijah, “The wife of Jeroboam is coming to see you to seek advice concerning her son.”
14:6	u8td				What did Ahijah say to the wife of Jeroboam?	When Ahijan heard her come in at the door he said to her, “Why do you pretend to be someone that you are not?”
14:8	ufrz				What did the God of Israel say about Jeroboam?	The God of Israel said to Jeroboam, “You have not been like my servant David who kept my commandments.”
14:9	due7				What did Jeroboam do to provoke Yahweh to anger?	Jeroboam cast metal images to provoke Yahweh to anger.
14:10	xyvz				What disaster would Yahweh bring on Jeroboam?	Yahweh said that he would cut off from him every male child in Israel.
14:11	v13w				What would happen to anyone of Jeroboam’s family who died in the city?	Anyone of Jeroboam’s family who died in the city would be eaten by dogs.
14:13	mcm4				What would all Israel do for the child of Jeroboam?	All Israel would mourn for and bury the child of Jeroboam.
14:15	azx3				How far did Yahweh say that he would scatter Israel?	Yahweh said that he would scatter Israel beyond the Euphrates river.
14:16	dt3w				What did Yahweh say that Jeroboam led Israel to do?	Yahweh said that Jeroboam led Israel to sin.
14:17	fpxy				What happened when Jeroboam’s wife came to the threshold of the house?	When Jeroboam’s wife came to the threshold of the house, the child died.
14:18	olbs				What did all Israel do after the child died?	All Israel mourned for him and buried him.
14:19	tf5j				Where were the other matters concerning Jeroboam written?	The other matters concerning Jeroboam were written in the Book of the Events of the Kings of Israel.
14:20	xlsv				How many years did Jeroboam reign before he slept with his fathers?	Jeroboam reigned for twenty-two years and slept with his fathers.
14:21	xs2t				Who was reigning in Judah?	Rehoboam the son of Solomon was reigning in Judah.
14:22	bebn				How did Judah provoke Yahweh to jealousy?	Judah provoked Yahweh to jealousy with the sins they committed.
14:23	zoxl				What did Judah build on every high hill and under every green tree?	Judah built shrines and Asherah poles on every high hill and under every green tree.
14:24	r0pr				What despicable things did the nations do?	The nations had male prostitutes in the land.
14:25	ge59				In what year did Shishak come up against Jerusalem?	In the fifth year of king Rehoboam, Shishak came up against Jerusalem.
14:26	ag6r				What shields did Shishak take away from Jerusalem?	Shishak took the shields of gold that Solomon had made.
14:27	j41b				What did King Rehoboam do with the shields of bronze that he made?	King Rehoboam entrusted them into the hands of the commander of the guard.
14:28	v0sp				When would the guards carry the shields of bronze?	Whenever the king entered the house of Yahweh, the guards would carry the shields.
14:29	fqqp				Where were the other matters of King Rehoboam written?	The other matters of King Rehoboam were written in The Book of the Events of the Kings of Judah.
14:31	gxwc				Who became king in Rehoboam’s place?	Abijah, Rehoboam’s son, became king in his place.
15:1	c2vq				When did Abijah begin to reign over Judah?	Abijah began to reign over Judah in the fifteenth year of King Jeroboam.
15:2	bi5a				How long did Abijah rule in Jerusalem?	Abijah ruled in Jerusalem for three years.
15:3	rm1c				Was Abijah’s heart devoted to Yahweh his God?	Abijah’s heart was not devoted to Yahweh his God.
15:4	hy69				Why did Yahweh raise up a son for Abijah in Jerusalem?	Yahweh raised up a son for Abijah to strengthen Jerusalem.
15:5	z05b				In what matter did David turn away from Yahweh?	David only turned away from Yahweh in the matter of Uriah the Hittite.
15:6	olrf				What happened all the days of Abijah’s life?	There was war between Rehoboam and Jeroboam all the days of Abijah’s life.
15:8	vdxq				When Abijah slept with his fathers who became king in his place?	When Abijah slept with his fathers Asa became king in his place.
15:9	lkxc				When did Asa begin to reign over Judah?	Asa began to reign over Judah in the twentieth year of Jeroboam king of Jerusalem.
15:10	evro				How many years did Asa reign in Jerusalem?	Asa reigned forty-one years in Jerusalem.
15:11	gipr				What did Asa do in the eyes of Yahweh?	Asa did what was right in the eyes of Yahweh as David had done.
15:12	crin				What did Asa do in the land?	Asa removed the male prostitutes and the idols his ancestors had made in the land.
15:13	pd57				Whom did Asa remove from being queen?	Asa removed his own grandmother Maacah from being queen.
15:14	osm9				What was the condition of Asa’s heart toward Yahweh?	Asa’s heart was completely devoted to Yahweh all his days.
15:15	fjrv				What did Asa bring into the house of Yahweh?	Asa brought consecrated things into the house of Yahweh.
15:16	j4o4				With whom was Asa at war?	Asa was at war with Baasha king of Israel all their days.
15:17	r4xi				Why did Baasha build up Ramah?	Baasha built up Ramah so that no one would enter into or leave the land of Asa.
15:18	dapd				What did Asa do with all the silver and gold from the storerooms of the house of Yahweh?	Asa sent the silver and gold to Benhadad who lived in Damascus.
15:19	x8g7				What did Asa say to Benhadad?	Asa said to Benhadad, “Let there be a treaty between me and you, as there was between my father and your father.”
15:20	r3ut				What did Benhadad do after he listened to Asa?	After he listened to Asa, Benhadad sent his armies to attack the cities of Israel.
15:21	x498				What did Baasha do when he heard about this?	When Baasha heard about the attacks, he stopped building up Ramah.
15:22	t6v6				What did Asa do with the materials that were used to build up Ramah?	Asa took the materials that were used to build up Ramah and used them to build up Geba and Mizpah.
15:23	fjcn				Where were all of Asa’s matters written?	All of Asa’s matters were written in The Book of the Events of the Kings of Judah.
15:24	rfc9				After Asa slept with his fathers, who became king in his place?	After Asa slept with his fathers, his son Jehoshephat became king in his place.
15:25	bwb1				Who began to reign over Israel in the second year of Asa?	Nadab the son of Jeroboam began to reign over Israel in the second year of Asa.
15:26	kc8n				How did Nadab walk in the sight of Yahweh?	Nadab did evil in the sight of Yahweh and walked in the ways of his father.
15:27	n9fh				What did Baasha son of Ahijah do at Gibbethon?	Baasha the son of Ahijah killed Nadab at Gibbethon.
15:29	tb5b				What did Baasha do as soon as he became king?	As soon as Baasha became king, he killed all of the family of Jeroboam.
15:31	u8a9				How long was there war between Asa and Baasha?	There was war between Asa and Baasha all their days.
15:33	pv2g				How long did Baasha reign in Tirza?	Baasha reigned in Tirza for twenty-four years.
15:34	njyr				How did Baasha live?	Baasha did evil in the sight of Yahweh and lived in the way of Jeroboam.
16:2	pedj				Out of what did Yahweh exalt Baasha?	Yahweh exalted him out of the dust.
16:4	uv9x				What would eat anyone belonging to Baasha who died in the city?	The dogs would eat anyone belonging to Baasha who died in the city.
16:7	wdm8				Why did the word of Yahweh come against Baasha and his family?	The word of Yahweh came against Baasha and his family, both because of all the evil he did in the sight of Yahweh, and also because he had killed all of Jeroboam’s family.
16:9-10	sc24				What was Elah doing when Zimri killed him?	Elah was drinking himself drunk in the house of Arza when Zimri killed him.
16:11	g25j				When did Zimri kill all the family of Baasha?	When Zimri began to reign, as soon as he had sat on his throne, he killed all the family of Baasha.
16:15	i31i				To whom did Gibbethon belong?	Gibbethon belonged to the Philistines.
16:18	moee				Where did Zimri kill himself?	Zimri killed himself in the fortress attached to the king’s palace.
16:21	blnq				By what two leaders were the people of Israel divided into two parts?	The people of Israel divided into two parts by Tibni the son of Ginath and by Omri.
16:24	spzd				Why did Omri call the name of the city Samaria?	Omri called the name of the city Samaria, after the name of Shemer, the past owner of the hill.
16:28	kgr7				Who became king in Omri’s place?	Ahab his son became king in his place.
16:32	c48t				Who had built the house of Baal in Samaria?	Ahab had built the house of Baal in Samaria.
16:34	e51j				What caused the loss of Hiel’s son Abiram?	Hiel rebuilt Jericho, causing the loss of Abiram.
17:1	ep0u				What ominous message did Elijah give to Ahab?	Elijah told Ahab that as Yahweh lives, there would not be dew or rain unless he said so.
17:4	qmg1				Who did Yahweh command to feed Elijah while Elijah was at the brook Cherith?	Yahweh commanded the ravens to feed Elijah at the brook Cherith.
17:7	q15s				What happened when there was no rain in the land?	The brook dried up when there was no rain in the land.
17:8-10	z0dc				Where did Elijah go after the brook dried up?	Yahweh sent Elijah to a widow in Zarephath.
17:12	okt1				Why was the widow gathering two sticks?	The widow was gathering two sticks so she could go in and cook for herself and her son, that they could eat, and die.
17:14	yado				For how long would the widow’s jar of meal and jug of oil be full?	They would be full until the day that Yahweh sent rain on the earth.
17:17	zuvk				How sick was the woman’s son?	The son’s sickness was so severe that there was no more breath left in him.
17:21	c998				What did Elijah do to save the child?	Elijah stretched himself on the child three times; he cried out to Yahweh and said, “Yahweh my God, I beg you, please let this child’s life return to him.”
17:22-23	samh				How did the woman know that Elijah was a man of God?	The woman knew that Elijah was a man of God when her son revived, and Elijah took the child and brought him out of his room down into the house.
18:1-2	cne2				What message did Yahweh ask Elijah to give to Ahab during the severe famine?	Yahweh asked Elijah to tell Ahab he would send rain on the land.
18:3-4	aotq				How did Obadiah honor Yahweh when Jezebel was killing the prophets of Yahweh?	Obadiah honored Yahweh by hiding one hundred prophets by fifties in a cave and feeding them with bread and water.
18:5-6	hjc5				Why did Ahab and Obadiah go through the land to all the water springs and brooks?	Ahab and Obadiah were searching for water and grass so they would not lose the horses and mules.
18:7-8	ngsm				What dangerous message did Elijah ask Obadiah to tell Ahab?	Elijah asked Obadiah to tell Ahab that “Elijah is here.”
18:9-11	n19x				Why was Obadiah reluctant to tell Ahab that “Elijah is here.”?	Obadiah was reluctant to tell Ahab, “Elijah is here.” because all the nearby nations had taken an oath that Elijah was not there.
18:12	awwa				What did Obadiah think would happen as soon as he left Elijah?	Obadiah thought the Spirit of Yahweh would carry Elijah some place Obadiah did not know.
18:14-15	iyd1				What did Elijah tell Obadiah to calm his fears?	Elijah told Obadiah that as Yahweh lives, he would surely show himself to Ahab that day.
