Reference	ID	Tags	Quote	Occurrence	Question	Response
18:16-17	ek0e				What did Ahab call Elijah when he met him?	Ahab called Elijah a “troublemaker” when he met him.
18:18	r9wq				How did Elijah respond to Ahab calling him a “troublemaker”?	Elijah told Ahab that he and his father’s family were the troublemakers because they abandoned the commandments of Yahweh to follow the Baal idols.
18:19	hh9r				Who did Elijah say to gather on Mount Carmel?	Elijah said to gather all the people of Israel, along with the 450 prophets of Baal and the four hundred prophets of Asherah who eat at Jezebel’s table.
18:21	ghh8				Who did Elijah tell the people they should follow?	Elijah told the people to follow Yahweh if he was God or Baal if he was God.
18:22-24	tv47				What proposal did Elijah bring before the people?	Elijah proposed that the prophets of Baal and himself each call upon their god to consume the sacrifice of a bull by fire to prove which one was god.
18:26	ule8				How long did the prophets of Baal call on Baal?	The prophets of Baal called on Baal from morning until noon.
18:28	bj5y				After Elijah mocked the prophets of Baal at noon what did the prophets of Baal do?	The prophets of Baal cried more loudly and cut themselves with swords and spears.
18:29	ai1k				How long did the prophets of Baal continue their raving?	The prophets of Baal were raving until the time of the evening sacrifice.
18:30-32	zm6i				What did Elijah do to the ruined altar of Yahweh?	Elijah repaired the altar of Yahweh with twelve stones,
18:32	ljvm				What did Elijah make around the altar of Yahweh?	Elijah dug a trench around the altar of Yahweh.
18:33-34	cgfn				What did Elijah have the people do to the wood and the bull for the burnt offering?	Three times Elijah had the people fill four jars with water and pour them on the burnt offering and the wood.
18:38-39	zzlb				How did the people of Israel respond when the fire of Yahweh fell and consumed the sacrifice and everything around it?	The people lay face down on the ground and said, “Yahweh, he is God!, Yahweh, he is God!”
18:40	olzo				What did Elijah do with the prophets of Baal?	Elijah brought the prophets of Baal down to the brook of Kishon and killed them.
18:43-44	u3c2				What did the servant of Elijah see after he looked toward the sea seven times?	After the seventh time, the servant saw a cloud as small as a man’s hand.
18:44	edkz				What did Elijah tell his servant to say to Ahab?	Elijah told his servant to tell Ahab to make ready his chariot and go down before the rain stopped him.
18:46	casj				What did Elijah do as Ahab rode and went to Jezreel?	Elijah tucked his robe in his belt and ran before Ahab to the entrance of Jezreel.
19:1-2	q524				What threat did Jezebel make to Elijah?	Jezebel told Elijah that she would make him to be one of the dead prophets by the next day.
19:3	u55r				How did Elijah respond to the threat from Jezebel?	Elijah fled for his life to Beersheba.
19:4	o2c7				Why did Elijah request that he might die?	Elijah requested that he might die because he felt he was no better than his dead ancestors.
19:5	vrz3				What happened as Elijah was sleeping under a broom tree?	An angel touched Elijah and said to him, “Get up and eat.”
19:6	tzuq				What did Elijah see and do after the angel touched him?	Elijah saw bread that had been baked on coals and a jug of water. Elijah ate and drank and lay down again.
19:8	a7je				How long did it take Elijah to get to Horeb, the mountain of God?	Elijah traveled forty days and forty nights to Horeb.
19:9-10	y41g				How did Elijah respond when Yahweh asked him what he was doing in a cave?	Elijah told Yahweh that he had been very zealous for him, but the people of Israel had forsaken his covenant, destroyed his altars, and killed his prophets, and he was the only one left.
19:15-16	ul6j				What did Yahweh tell Elijah to do?	Yahweh told Elijah to return to the wilderness to anoint Hazael to be king over Aram, Jehu to be king over Israel, and Elisha to be a prophet in his place.
19:18	y8c3				How did Yahweh respond to Elijah’s claim that he was the only prophet left in the land?	Yahweh told Elijah there were seven thousand people in Israel who were faithful to him.
19:19-20	tnac				What excuse did Elisha give to Elijah after he draped his cloak on him?	Elisha asked Elijah to let him kiss his mother and father before he followed him.
20:1-2	unjd				What was the message which Ahab received from Ben Hadad when the city of Samaria was under siege?	Ben Hadad told Ahab that his silver and gold as well as his wives and children were now Ben Hadad’s possessions.
20:4-6	gi9m				How did Ben Hadad respond to Ahab’s willingness to give him his silver, gold, wives, and children?	Ben Hadad informed Ahab that he was sending his servants the next day, and they would seize with their hands whatever pleased their eyes.
20:7-8	nxmc				What was the advice which the king of Israel received from all the elders of the land and the people?	The elders of the land and the people told the king not to listen or consent to the demands of Ben Hadad because he was only seeking trouble.
20:9	yukx				What was the message Ahab sent back to Ben Hadad?	Ahab told Ben Hadad that he was agreeable to his first demand, but he could not accept his second demand.
20:10	h0wh				What was the response of Ben Hadad to the message of Ahab?	Ben Hadad took an oath that he would reduce Samaria to ashes.
20:11-12	cq4b				What did Ben Hadad say when the king of Israel told him that he should not boast as if the battle was over?	Ben Hadad told his soldiers to line up in position to prepare for battle.
20:13-15	i6ds				Who did Yahweh say would win the battle for Israel against the great army of the Arameans?	Yahweh told Ahab that the young officers who served the governors of the districts would win the battle for Israel.
20:16-17	klnd				When the young officers who served the governors of the districts went forward first what were Ben Hadad and the thirty-two lesser kings who were supporting him doing?	Ben Hadad and his thirty-two lesser kings were drinking themselves drunk.
20:20-21	wbxg				What happened to Ben Hadad and the Arameans?	Ben Hadad escaped on a horse with some horsemen and many or the Arameans were killed in a great slaughter.
20:22	n3ih				What message did the prophet bring to the king of Israel?	The prophet told the king of Israel that the king of Aram would return against them again, so Israel should strengthen itself and plan what they would do.
20:23	o070				What did the servants of the king of Aram give as the reason for Israel being stronger in battle than the Arameans?	The servants of the king of Aram told him Israel was stronger than the Arameans, since their god is a god of the hills.
20:26	hw7x				What did Ben Hadad do after the beginning of the new year?	Ben Hadad mustered the Arameans and went up to Aphek to fight against Israel.
20:28	en76				What did a man of God say to the king of Israel concerning the Arameans?	The man of God said that because the Arameans said God was a god of the hills and not a god of the valleys, God was going to place the Aramean army into the hands of the king of Israel.
20:29-30	a42e				What was the outcome of the battle between the armies?	Israel killed one hundred thousand Aramean footmen in one day. The rest fled to Aphek, into the city where a wall fell on twenty-seven thousand men who were left and Ben Hadad fled into the city into an inner room.
20:31-32	vhn6				What did Ben Hadad’s servants do for Ben Hadad?	Ben Hadad’s servants put sackcloth on their waists and ropes around their heads and went to the king of Israel and begged the king of Israel to let Ben Hadad live.
20:33-34	dwdp				What proposal did Ben Hadad make to Ahab when he was summoned to meet with him in his chariot?	Ben Hadad told Ahab that he would restore to him the cities which had been taken from Israel if Ahab would let him go.
20:35-36	m5t2				Why was one of the prophets killed by a lion?	One of the prophets was killed by a lion because he did not obey the voice of Yahweh by hitting his fellow prophet.
20:37-38	zs6x				How did the prophet disguise himself from the king after he had been hit and wounded?	The prophet disguised himself from the king with a bandage over his eyes.
20:39-40	a6pq				Why did the prophet tell a story to the king of Israel?	The prophet told the story to the king of Israel to deceive him, so the king would make a ruling which would result in the forfeit of the king’s own life.
20:41-43	ohgh				What bold statement did the prophet make to the king of Israel?	The prophet told the king that he would lose his own life since he had allowed the man whom Yahweh had sentenced to death to live.
21:1-2	vncn				What did Ahab the king of Samaria want from Naboth the Jezreelite?	Ahab, king of Samaria, wanted the vineyard from Naboth, which was near his palace.
21:2	ygxa				What did Ahab offer Naboth for his vineyard?	Ahab offered to give Naboth a better vineyard or to pay him money.
21:3	wd22				Why did Naboth refuse to give his vineyard to Ahab?	Naboth refused to give his vineyard to Ahab because it was the inheritance of his ancestors.
21:4	a90h				What did Ahab do when Naboth refused to give up his vineyard?	Ahab became resentful and angry, went to bed, and refused to eat any food.
21:7	l1e5				Who told Ahab to get up from bed, eat, and be happy?	Ahab’s wife, Jezebel, told him to get out of bed, eat, and be happy.
21:10	ajop				What did Jezebel do to make sure Ahab would get Naboth’s vineyard?	Jezebel had two dishonest men falsely accuse Naboth of blasphemy against God and the king at a public fast.
21:10	hfdw				What would be the penalty for Naboth’s blasphemy?	Naboth would be taken out and stoned to death.
21:17	e9zs				Who did Yahweh send to the vineyard to meet Ahab?	Yahweh sent Elijah the Tishbite to the vineyard.
21:18	t4af				What did Ahab do when Jezebel told him that Naboth was dead?	When Ahab heard that Naboth was dead, he went to the vineyard to take possession of it.
21:19	piye				What did Elijah tell Ahab would happen to him because of his sin?	Elijah told Ahab that dogs would lick his blood where they had licked the blood of Naboth.
21:22	zc4l				What message did Elijah deliver to Ahab from Yahweh?	Elijah told Ahab that Yahweh said that he would be cut off from every male child and slave and free man in Israel because he had led Israel to sin.
21:23	iafx				What would happen to Jezebel?	The dogs would eat Jezebel by the wall of Jezreel.
21:27	rbtc				What did Ahab do when he heard these words?	Ahab tore his clothes, put on sackcloth on his body, and fasted.
21:29	ecab				What did Yahweh do when Ahab humbled himself before him?	Yahweh said that he would not bring this disaster in Ahab’s day, but would do it in his son’s day.
22:1	jpil				How long was there no war between Aram and Israel?	For three years there had been no war between Aram and Israel.
22:2	oupx				Who was the king of Judah?	The king of Judah was Jehoshaphat.
22:4	aj63				What did the king of Israel ask Jehoshaphat to do with him?	The king of Israel asked Jehoshaphat to go to Ramoth Gilead and make war on the king of Aram.
22:6	m0t5				Who did the king of Israel call together to seek the will of Yahweh in this matter?	The king of Israel gathered the prophets, 400 men, and asked them about making war on Aram.
22:9	b6ik				From what other prophet did the king of Israel seek advice?	The king of Israel called upon Micaiah the son of Imiah.
22:12	bpkp				As the kings Ahab and Jehoshaphat sat on their thrones before the prophets, what was the prophesy they heard?	As the kings Ahab and Jehoshaphat sat on their thrones, all the prophets said to them that they should attack Ramoth Gilead and win.
22:15	qmk0				Was Micaiah in agreement with all the other prophets?	Yes, Micaiah was in agreement with all the other prophets.
22:17	stip				What bad news did Micaiah tell the king of Israel?	Micaiah told the king of Israel that they would have no shepherd and would be scattered.
22:21-23	hf1z				How did Micaiah tell the king of Israel that he would be enticed to go to Ramoth Gilead?	Micaiah told the king of Israel that he would be enticed to go to Ramoth Gilead by the lies his prophets would tell him.
22:26-27	o6n0				What did the king of Israel order to be done to Micaiah?	The king of Israel ordered that Micaiah be seized and put in prison and be fed only a little bread and water until the king of Israel returned safely.
22:30	horj				What did the king of Israel do to avoid capture in the battle at Ramoth Gilead?	The king of Israel disguised himself to avoid capture at Ramoth Gilead.
22:34	lko2				How did Ahab receive a serious wound at the battle of Ramoth Gilead?	A soldier of Aram shot his bow at random and it struck Ahab between the joints of his armor.
22:37	d7te				Where was Ahab buried?	Ahab was buried in Samaria.
22:40	o7x7				Who became king at the death of Ahab?	His son Ahaziah became king of Israel.
22:42	rduv				How long did Jehoshaphat reign in Jerusalem?	Jehoshaphat reigned in Jerusalem for twenty-five years.
22:43	ucnv				What was said about the reign of Jehoshaphat?	It was said that Jehoshaphat did what was right in the eyes of Yahweh.
22:52	s56u				What was said about the reign of Ahab?	It was said that Ahab did what was evil in the eyes of Yahweh.
