Reference	ID	Tags	Quote	Occurrence	Question	Response
13:5	oyi5				For what did Paul tell the Corinthian saints to examine and test themselves?	Paul told them to examine and test themselves to see if they were in the faith.
13:6	tpme				What was Paul confident the Corinthian saints would find concerning Paul and his companions?	Paul was confident the Corinthian saints would find that they were not unapproved, but approved by God.
13:8	x6m8				What did Paul say that he and his companions were not able to do?	Paul said they were not able to do anything against the truth.
13:10	m3b8				Why did Paul write these things to the Corinthian saints while he was away from them?	Paul did this so that when he was with them, he would not have to act harshly toward them.
13:10	qgbu				How did Paul want to use the authority the Lord gave him with regard to the Corinthian saints?	Paul wanted to use his authority to build up the Corinthian saints and not tear them down.
13:11-12	qz8o				In concluding, what did Paul want the Corinthians to do?	Paul wanted them to rejoice, to work for restoration, to agree with one another, to live in peace, and to greet each other with a holy kiss.
13:14	jbtv				What did Paul want all the Corinthian saints to have with them?	Paul wanted them all to have the grace of the Lord Jesus Christ, the love of God, and the fellowship of the Holy Spirit.
