Reference	ID	Tags	Quote	Occurrence	Question	Response
16:20	cnsz				What happened to the bread from Yahweh that some of the Israelites left until morning?	The bread from Yahweh that some of the Israelites left until morning bred worms and became foul.
16:22	k3xx				How much bread did the Israelites gather on the sixth day?	On the sixth day they gathered twice as much bread, two omers for each person.
16:24	l4yt				What happened to the bread of Yahweh that was set aside until the seventh day?	The bread of Yahweh that was set aside until the seventh day did not become foul, nor was there any worm in it.
16:27	iin7				How much manna did the Israelites find on the seventh day?	When some of the people went out to gather manna on the seventh day, they found none.
16:29	on2x				What must each of the Israelites do on the seventh day?	Each of them must stay in his own place; no one must go out from his place on the seventh day.
16:31	fa0s				What was manna?	Manna was food that was white like coriander seed, and its taste was like wafers with honey.
16:32	r5rn				Why will an omer of manna be kept?	An omer of manna will be kept throughout the people’s generations so that their descendants might see the bread with which Yahweh fed them in the wilderness.
16:33-34	sygd				Where will an omer of manna be kept?	An omer of manna will be kept in a pot and stored beside the covenant decrees inside the ark.
16:35	w9zu				For how long did the people of Israel eat manna?	The people of Israel ate manna forty years, until they came to inhabited land.
17:1-3	crh3				Why did the people blame Moses for their situation?	There was no water for the people to drink, so the people blamed Moses for their situation and murmured against him.
17:4	j0dj				What was Moses afraid the people would do to him?	Moses was afraid that the Israelites were ready to stone him.
17:6	kyyo				What did Yahweh tell Moses to do to provide water for the people to drink?	Yahweh told Moses to strike the rock with his staff. Water would come out of the rock for the people to drink.
17:9	mffm				Where did Moses stand when the Amalek people attacked Israel?	Moses stood on top of the hill with the staff of God in his hand.
17:11	jeex				What happened while Moses was holding his hands up and when he let his hands rest?	While Moses was holding his hands up, Israel was winning. When he let his hands rest, Amalek would begin to win.
17:12	iud3				How did Aaron and Hur help Moses hold his hands up?	Aaron and Hur took a stone and put it under him for him to sit on. At the same time, Aaron and Hur held his hands up, one person on one side of him and the other person on the other side.
17:14	lwpl				Why did Yahweh tell Moses to write about the battle against the Amalek?	Yahweh told Moses to write about the battle in a book, because Yahweh will completely blot out the memory of Amalek from under the skies.
18:1	exy6				Who was Jethro?	Jethro was the priest of Midian, Moses’ father-in-law.
18:2-4	dg4r				What were the names of the two sons of Moses?	The sons of Moses were Gershom and Eliezer.
18:6	yd0f				Where was Moses when Jethro brought his wife and sons?	Moses was camped in the wilderness at the mountain of God when Jethro brought Moses’ sons and his wife to him.
18:7	j4iv				How did Moses greet his father-in-law?	He bowed down and kissed him.
18:9	wokw				Over what did Jethro rejoice?	Jethro rejoiced over all the good that Yahweh had done for Israel in that he had rescued them from the Egyptians’ power.
18:11	qilq				How did Jethro know that Yahweh was greater than all the gods?	Jethro knew that Yahweh was greater than all the gods because when the Egyptians treated the Israelites arrogantly, God rescued his people.
18:12	t2dg				Who ate the meal before God?	Aaron and all the elders of Israel came to eat a meal before God with Moses’ father-in-law.
18:13	cvgl				How long did the people stand around Moses as he sat down to judge the people?	The people stood around Moses from morning until evening.
18:15-16	ixct				Why did the people come to Moses?	When they had a dispute, the people came to Moses to ask for God’s direction.
18:17-18	arhx				Why did Jethro say that what Moses was doing was not good?	Jethro said that what Moses was doing was not very good because he would certainly wear himself out; the many people who came to him were a burden too heavy for him to carry alone.
18:21	walh				What kind of men did Jethro tell Moses to choose to put over the people?	Jethro told Moses to choose capable men from all the people, men who honor God, men of truth who hate unjust gain.
18:22	byhh				What cases would the capable men judge?	The capable men would judge the people in all routine cases, but the difficult cases they would bring to Moses. As for all the small cases, they could judge those themselves.
19:1	c763				When did the people of Israel come to the wilderness of Sinai?	In the third month after the people of Israel had gone out from the land of Egypt, on the same day, they came to the wilderness of Sinai.
19:5	tak7				What must the Israelites do if they want to be Yahweh’s special possesssion?	The Israelites must obediently listen to Yahweh’s voice and keep his covenant, then they would be his special possession from among all peoples.
19:9	u836				Why did Yahweh come to the people in a thick cloud?	Yahweh came to them in a thick cloud so that the people might hear when he spoke with them and might also believe Moses forever.
19:10	ypcq				How were the people to consecrate themselves?	They were to consecrate themselves by preparing for Yahweh’s coming and by washing their garments.
19:12	lmrf				What would happen to anyone who touched the mountain?	Whoever touched the mountain would surely be put to death.
19:13	g0x7				How were the people to put to death anyone who touched the mountain?	They were to stone or shoot the person who touched the mountain.
19:16	re0y				Why did the people tremble?	There were thunder and lightning bolts and a thick cloud on the mountain and the sound of a very loud trumpet, so all the people in the camp trembled.
19:22	o37u				What should the priests do so Yahweh would not attack them?	The priests who come near to Yahweh should set themselves apart—prepare themselves for Yahweh’s coming—so that Yahweh would not attack them.
19:24	n4g2				Who could come up the mountain with Moses?	Only Aaron could come up the mountain with Moses.
20:3	fm4s				What must the Israelites not have before Yahweh?	They must have no other gods before him.
20:4-5	pljy				Why must the Israelites not make carved figures or bow down to them?	The Israelties must not make carved figures or bow down to them because Yahweh is a jealous God.
20:5	npd3				For how long does Yahweh punish the ancestors’ wickedness?	Yahweh punishes the ancestors’ wickedness by bringing punishment on their descendants to the third and the fourth generation of those who hate him.
20:7	o2ui				Whose name must the Isralites not take in vain?	They must not take the name of Yahweh their God in vain.
20:8	amc2				Why must the Israelites keep the Sabbath day holy and rest on it?	The Israelites must keep the Sabbath day holy and rest on it because Yahweh told them to set it apart for him.
20:10	otrz				Who should keep the Sabbath day holy and rest on it?	The Israelites must not do any work, they, nor their son, nor their daughter, nor their male servant, nor their female servant, nor their cattle, nor the foreigner who is within their gates.
20:11	p56v				Why must the Israelites keep the Sabbath day holy and rest on it?	The Israelites must keep the Sabbath day holy and rest on it, for in six days Yahweh made the heavens, earth, and sea, and everything that is in them, and then rested on the seventh day.
20:12	l0nl				What is the result of the Israelites’ honoring their father and mother?	The Israelites must honor their father and your mother so that they might live a long time in the land which Yahweh their God was giving them.
20:18	l1dy				Why did the people tremble?	All the people saw the thundering and the lightning and heard the voice of the trumpet and saw the mountain smoking. When the people saw it, they trembled and stood far off.
20:19	v3kk				What did the Israelites think would happen if God spoke to them?	They thought that if God spoke to them, they would die.
20:25	bvb0				What would have happened if the Israelites used their tools on the stone altar?	If they used their tools on the stone altar, they would defile it.
21:1	zle3				Who must set the decrees before the Israelites?	Moses must set the decrees before the Israelites.
21:4	e111				If a master gave a servant a wife and she bore him sons or daughters, what would happen to them if the servant went free?	If a master gave a servant a wife and she bore him sons or daughters, the wife and her children would belong to her master, and he must go free by himself
21:6	r0ay				If the servant would not go free, what would happen?	If the servant would not go free, the master must bring him to a door or doorpost, and his master must bore his ear through with an awl. Then the servant would serve him for the rest of his life.
21:8	p3xj				To whom can a master not sell a female servant?	A master has no right to sell a female servant to a foreign people.
21:9-11	lljg				When can a female servant go free without paying money?	If a master’s son marries a female servant and then takes another wife for himself, he can not diminish her food, clothing, or her marital rights. But if he does not provide these three things for her, then she can go free without paying any money.
21:13	qdon				What did Yahweh provide for a man who killed someone by accident?	If the man killed someone by accident, Yahweh would appoint a place where he could flee.
21:17	hhfo				What must happen to whoever acts contemptuously toward his father or his mother?	Whoever acts contemptuously toward his father or his mother must surely be put to death.
21:18-19	mwx0				If men fight and one hits the other with a stone or with his fist and the other is confined to his bed, what must the man who struck him do?	If men fight and one hits the other with a stone or with his fist and the other is confined to his bed, the man who struck him must pay for the loss of his time.
21:20-21	kksd				If a man hits his male servant or his female servant with a staff, and if the servant lives for a day or two, how will the master be punished?	If a man hits his male servant or his female servant with a staff, and if the servant lives for a day or two, the master must not be punished, for he will have suffered the loss of the servant..
21:22	fj5h				If men fight together and hurt a pregnant woman so that she miscarries, but there is no other injury to her, what must happen to the guilty man?	If men fight together and hurt a pregnant woman so that she miscarries, but there is no other injury to her, then the guilty man must surely be fined if the woman’s husband demands it from him, and he must pay as the judges determine.
21:23-25	ux4z				What must the guilty man give if there is serious injury?	If there is serious injury, then the guilty man must give a life for a life, an eye for an eye, a tooth for a tooth, a hand for a hand, a foot for a foot, a burn for a burn, a wound for a wound, or a bruise for a bruise.
21:26-27	olyy				If a man hits the eye of his male servant or of his female servant and destroys it or if he knocks out a tooth of his male servant or female servant, what is the compensation?	If a man hits the eye of his male servant or of his female servant and destroys it or if he knocks out a tooth of his male servant or female servant, he must let the servant go free as compensation for the tooth.
21:29	lmbo				If an ox had a habit of goring in the past, and its owner was warned but did not keep it in, and the ox kills a man or a woman, what must happen to the ox and its owner?	If an ox had a habit of goring in the past, and its owner was warned but did not keep it in, and the ox kills a man or a woman, that ox must be stoned, and its owner also must be put to death.
21:33-34	iq91				If a man opens a pit, or if a man digs a pit and does not cover it, and an ox or a donkey falls into it, what must the owner of the pit do?	If a man opens a pit, or if a man digs a pit and does not cover it, and an ox or a donkey falls into it, the owner of the pit must repay the loss.
21:35	lcrj				If one man’s ox hurts another man’s ox so that it dies, what must happen to the oxen?	If one man’s ox hurts another man’s ox so that it dies, then they must sell the live ox and divide its price, and they must also divide the dead ox.
22:2-3	vuk1				If someone kills a thief after the sun has risen, who is guilty?	If the sun has risen before a thief breaks in, guilt for murder will attach to the person who kills him.
22:3	c6gu				If a thief has nothing, what is his restitution?	If a thief has nothing, then he must be sold for his theft.
22:7-8	am3j				If a man gives money or goods to his neighbor for safe keeping, and if it is stolen out of the man’s house, but the thief is not found, what will happen?	If a man gives money or goods to his neighbor for safe keeping, and if it is stolen out of the man’s house, if the thief is found, that thief must pay double. But if the thief is not found, then the owner of the house must come before the judges to see whether he has put his own hand on his neighbor’s property.
22:10-11	cdaa				If a man gives his neighbor a donkey, an ox, a sheep, or any animal to keep, and if it dies or is hurt or is carried away without anyone seeing it, what is the restitution?	If a man gives his neighbor a donkey, an ox, a sheep, or any animal to keep, and if it dies or is hurt or is carried away without anyone seeing it, the other will make no restitution.
22:16	gjay				If a man seduces a virgin who is not engaged, and if he sleeps with her, how must he make her his wife?	If a man seduces a virgin who is not engaged, and if he sleeps with her, he must surely make her his wife by paying the bride wealth required for this.
22:21	l7sg				Why must the Israelites not wrong a foreigner?	The Israelites must not wrong a foreigner or oppress him, for they were foreigners in the land of Egypt.
22:22-24	rq7y				What would happen if the Israelites mistreated any widow or fatherless child?	If the Israelites mistreats them at all, and if they cry out to Yahweh, he will surely hear their cry. His anger will burn, and he will kill them with the sword; their wives will become widows, and their children will become fatherless.
22:26	w8kg				If someone takes his neighbor’s garment in pledge, when must he return it to the owner?	If someone takes his neighbor’s garment in pledge, he must return it to him before the sun goes down.
22:31	pg41				What meat must the Israelites not eat? What should they do with it?	The Israelites must not eat any meat that was torn by animals in the field. Instead, they must throw it to the dogs.
23:5	shr6				If the Israelites see the donkey of someone who hates them fallen to the ground under its load, what must they do?	If the Israelites see the donkey of someone who hates them fallen to the ground under its load, they must not leave that person. They must surely help him with his donkey.
23:8	mu02				Why should the Israelites not take a bribe?	They should not take a bribe, for a bribe blinds those who see, and perverts honest people’s words.
23:11	em7p				Why should the Israelites leave their fields unplowed in the seventh year?	In the seventh year the Isralites should leave the fields unplowed and fallow so that the poor among their people may eat.
23:12	nix9				Why must the Israelites rest on the seventh day?	On the seventh day they must rest so that their ox and their donkey may have rest, and so that their female slave’s son and any foreigner may rest and be refreshed.
23:15	k13x				In what month was the Festival of Unleavened Bread to be observed?	The Festival of Unleavened Bread was to be observed in the month of Aviv.
23:15	p0v4				In what month did the Israelites come out of Egypt?	They came out of Egypt in the month of Aviv.
23:16	bbgc				When were the Festival of Harvest and the Festival of Ingathering to be observed?	You must observe the Festival of Harvest with the first fruits of your labors when you sowed seed in the fields. Also you must observe the Festival of Ingathering at the end of the year when you gather in your produce from the fields.
23:18	vx8n				For how long can the fat from the sacrifices at Yahweh’s festivals remain?	The fat from the sacrifices at Yahweh’s festivals must not remain all night until the morning.
23:21	h2eo				What would happen if the Israelites provoke Yahweh’s angel?	If they provoke him, he will not pardon their transgressions.
23:24	qxdf				What must the Israelites do to foreign gods?	They must completely overthrow them and smash their sacred stone pillars in pieces.
23:29	qonu				Why wouldn’t Yahweh drive out the foreign nations before the Israelites in one year?	Yahweh would not drive them out in one year or the land would become abandoned, and the wild animals would become too many for them.
23:33	hj34				Why must foreign nations not live in the Israelites’ land?	They must not live in the Israelites’ land, or they would make the Israelites sin against Yahweh.
24:1	x4qn				How many elders should come up to worship Yahweh at a distance?	Seventy elders should come up to worship Yahweh at a distance.
24:4	snct				What would the 12 stones represent?	The 12 stones would represent the 12 tribes of Israel.
24:5-6	n0hw				Where did Moses put the blood of the oxen from the fellowship offerings to Yahweh?	Moses took half of the blood of the oxen from the fellowship offerings to Yahweh and put it into basins; he splashed the other half onto the altar.
24:8	xznk				How did Yahweh make a covenant with the Israelites?	Yahweh made the covenant with the Israelites by sprinkling them with blood and giving them the promise with all the words.
24:9-10	imeg				Who saw Yahweh?	Moses, Aaron, Nadab, Abihu, and seventy of Israel’s elders saw Yahweh.
24:12	a5qi				Why did Yahweh give Moses the tablets of stone and the law and commandments?	Yahweh gave Moses the tablets of stone and the law and commandments that he had written so that Moses might teach them.
24:14	o1ln				If anyone had a dispute, to whom should he go?	If anyone had a dispute, he should go to Aaron and Hur.
24:17	vewc				What was the appearance of Yahweh’s glory like?	The appearance of Yahweh’s glory was like a devouring fire on the top of the mountain in the eyes of the Israelites.
25:2	gpe3				From whom should the Israelites take an offering?	The Israelites should take an offering from every person who is motivated by a willing heart.
25:7	sv4z				For what were the onyx stones and other precious stones to be set?	The onyx stones and other precious stones were to be set for the ephod and breastpiece.
25:8	rjod				Why would the Israelites make Yahweh a sanctuary?	The Israelites would make Yahweh a sanctuary so that he might live among them.
25:10-11	daz5				With what must Moses cover the acacia wood?	He must cover it inside and out with pure gold.
25:14	boa5				Into what must Moses put the poles? Why?	He must put the poles into the rings on the box’es sides in order to carry the box.
25:15	heaw				Where must the poles remain?	The poles must remain in the rings of the box. They must not be taken from it.
25:20	q59y				Which direction must the cherubim face?	The cherubim must face one another and look toward the center of the atonement lid.
25:22	pi6a				From where would Yahweh speak to Moses?	Yahweh would speak with him from above the atonement lid, from between the two cherubim over the Box of the Testimony.
25:23-24	yv6u				What border must Moses put around the top of the table of acacia wood?	He must put a border of gold around the top of the table of acacia wood.
25:27	ws0g				Why must the rings be attached to the frame?	The rings must be attached to the frame to provide places for the poles in order to carry the table.
25:29	gw4s				What was to be used to pour out drink offerings?	The dishes, spoons, pitchers, and bowls were to be used to pour out drink offerings.
25:31-32	u38c				How many branches must extend out from the sides of the lampstand of pure hammered gold?	Six branches must extend out from its sides—three branches must extend from one side, and three branches of the lampstand must extend from the other side.
25:33-34	kpkg				On which part of the lampstand must there be four cups made like almond blossoms?	On the lampstand itself, the central shaft, there must be four cups made like almond blossoms.
25:35	cp1l				What must be under each pair of branches?	There must be a bulb under each pair of branches.
25:39	uf2a				How much gold should Moses use to make the lampstand and its accessories?	He must use one talent of pure gold to make the lampstand and its accessories.
26:1	cm0r				Who would Moses have to make the Dwelling with ten curtains made from fine linen and blue, purple, and scarlet wool with the designs of cherubim?	Moses must have a very skilled craftsman make the Dwelling with ten curtains made from fine linen and blue, purple, and scarlet wool with the designs of cherubim.
26:5	elsd				How should Moses position the fifty loops on the first curtain and fifty loops on the end curtain in the second set?	He must make fifty loops on the first curtain and fifty loops on the end curtain in the second set so that the loops will be opposite to each other.
26:7	fps4				Of what must Moses make curtains for a tentlike covering over the Dwelling?	He must make curtains of goats’ hair for a tentlike covering over the Dwelling.
26:12	kgvo				Where must the overhanging part remaining from the tent’s curtains hang?	The overhanging part remaining from the tent’s curtains must hang at the back of the Dwelling.
26:17	k1kb				What must be in each board for joining them to each other?	There must be two projections called tenons in each board for joining the boards to each other.
26:19	vg23				Why must there be two bases under each board?	There must be two bases under each board to be for its two tenons.
26:30	d71m				How must Moses set up the Dwelling?	He must set up the Dwelling by following the plan God showed him on the mountain.
26:33	axti				What is the purpose of the curtain?	The curtain is to separate the Holy from the Holy of Holies.
26:35	pc4l				On what side of the Dwelling is the lampstand?	The lampstand is opposite the table on the south side of the Dwelling.
27:2	agdf				How must Moses make extensions of the altar’s four corners?	He must make extensions of its four corners shaped like ox horns.
27:3	qlgu				With what must Moses make all the utensils for the altar?	He must make all the utensils with bronze.
27:9	wyse				What kind of hangings must be on the south side of the courtyard?	There must be hangings of fine twisted linen 100 cubits long on the south side of the courtyard.
27:19	an0b				Of what material must all the equipment to be used in the Dwelliing and all the tent pegs for the Dwelling and courtyard be made?	All the equipment to be used in the Dwelling and all the tent pegs for the Dwelling and courtyard must be made of bronze.
27:21	wljp				What would be a lasting ordinance forever throughout the generations of the Israelite nation?	Aaron and his sons must maintain the lamps from evening to morning before Yahweh. This requirement would be a lasting ordinance forever throughout the generations of the Israelite nation.
28:1	icmq				Who would serve Yahweh as priests?	Aaron and his sons—Nadab, Abihu, Eleazar, and Ithamar—would serve Yahweh as priests.
28:5	sp1k				What material must craftsmen use for the priests’ clothing?	Craftsmen must use fine linen that is gold, blue, purple, and scarlet.
28:9	tapd				What must be engraved on two onyx stones?	The names of Israel’s 12 sons must be engraved on two onyx stones.
28:10	d41c				In what order must the names of Israel’s twelve sons be on the two onyx stones?	The names of Israel’s twelve sons must be on the two onyx stones in the order of the sons’ births.
28:12	h1t0				Why would Aaron carry the names of the Israel’s 12 sons on his two shoulders?	Aaron would carry their names on his two shoulders as a reminder to Yahweh.
28:15-16	sg15				What shape must the breastpiece for decision making be?	The breastpiece for decision making must be square.
28:17	d101				How must the precious stones be mounted?	They must be mounted four rows of three each
28:20	ou36				How must the precious stones be mounted?	They must be mounted in gold settings.
28:24	q5rl				Where must Moses attach the two golden chains?	He must attach the two golden chains to the two corners of the breastpiece.
28:28	ege3				Why must Moses tie the breastpiece by its rings to the ephod’s rings?	He must tie the breastpiece by its rings to the ephod’s rings so that the breastplate might not separate from the ephod.
28:30	pp9y				What must Moses put in the breastpiece for decision-making?	He must put in the breastpiece for decision-making the Urim and the Thummim.
28:31-32	nlh4				Of what must the robe of the ephod be made?	The robe of the ephod must be made entirely of blue.
28:35	ch6g				Why is the robe to be on Aaron when he serves?	The robe is to be on Aaron when he serves so that the sound of its bells can be heard when he goes into the Holy Place before Yahweh and when he leaves. This is so that he does not die.
28:36-38	i65j				How would Aaron bear any guilt that might attach to the offering of the holy gifts that the Israelites consecrated?	He would bear any guilt that might attach to the offering of the holy gifts that the Israelites consecrated by wearing the engraved plate on his turban.
