Reference	ID	Tags	Quote	Occurrence	Question	Response
1:1	r2gg				Into what country did the sons of Israel come with Jacob?	The sons of Israel came into Egypt with Jacob.
1:5	xbyk				How many descendants of Jacob were there?	All of the descendants of Jacob were 70 in number.
1:8	vxqq				Who did not care for the memory of Joseph?	A new king arose over Egypt, who did not care for the memory of Joseph.
1:8	wagv				What did the king of the Egyptians think would happen if they did not deal wisely with the Israelites?	The king of the Egyptians was afraid that the Israelites would continue to multiply, and if war would break out, they would join the Egyptians’ enemies, fight against them, and leave the land.
1:11	s0rg				How did the taskmasters oppress the Israelites?	The taskmasters oppressed the Israelites with hard labor.
1:12	e3ku				What happened the more the Egyptians oppressed the Israelites?	The more the Egyptians oppressed the Israelites, the more the Israelites increased in number and spread.
1:16	m8ha				What did the king of Egypt tell the midwives to do if the baby was a male?	The king of Egypt told them that if the baby was male, then they must kill him.
1:17	tzxq				Why did the midwives not do as the king of Egypt ordered them?	The midwives feared God and so they did not do as the king of Egypt ordered them.
1:19	oxp0				How did the midwives say the Hebrew women were not like the Egyptian women?	They said Hebrew women were vigorous and finished giving birth before a midwife came to them.
1:22	sse2				What did Pharaoh order all his people to do to the male babies?	Pharaoh ordered all his people, “You must throw every male that is born into the river”.
2:2	dc4k				For how long did the woman of Levi hide her son?	The woman of Levi hid her son for three months.
2:3	b58k				With what did the woman of Levi seal the papyrus basket?	She sealed the papyrus basket with bitumen and pitch.
2:4	vo29				Why did the baby’s sister stand at a distance?	The baby’s sister stood at a distance to see what would happen to him.
2:5	uwbd				What did Pharaoh’s daughter come to do while her attendants walked along by the riverside?	Pharaoh’s daughter came down to bathe at the river while her attendants walked along by the riverside.
2:7-8	c3mv				Who did the young girl find to nurse the child for Pharaoh’s daughter?	The young girl went and got the child’s mother to nurse the child for Pharaoh’s daughter.
2:10	afnh				Who named the child Moses?	Pharaoh’s daughter named the child Moses.
2:12	espm				Where did Moses hide the body of the Egyptian whom he killed?	Moses killed the Egyptian and hid his body in the sand.
2:13	kqsm				When two Hebrew men were fighting, whom did Moses ask, “Why are you hitting your companion?”	When two Hebrew men were fighting, Moses said to the one who was in the wrong, “Why are you hitting your companion?”
2:15	o04w				Why did Pharaoh not kill Moses?	Pharaoh tried to kill Moses, but Moses fled from Pharaoh and stayed in the land of Midian.
2:17	hu5y				Who tried to drive away the daughters of the priest of Midian?	Some shepherds came and tried to drive away the daughters of the priest of Midian.
2:24	s7bn				When did God call to mind his covenant with Abraham, with Isaac, and with Jacob?	When God heard the Israelites groaning, God called to mind his covenant with Abraham, with Isaac, and with Jacob.
3:1	iir7				Who was Moses’ father-in-law?	Jethro, the priest of Midian, was Moses’ father-in-law
3:2	ylfy				How did the angel of the Lord appear to Moses?	The angel of Yahweh appeared to Moses in a flame of fire in a bush.
3:4	wayx				Who called to Moses out of the bush?	God called to Moses out of the bush
3:5	y5h3				Why did God tell Moses to take off his shoes from his feet?	God said, “Do not come any closer! Take off your shoes from your feet, for the place where you are standing is ground consecrated for my own purpose.”
3:8	ov8u				Why did Yahweh come down?	Yahweh came down to free the Israelites from the Egyptians’ power and to bring them up from that land to a good, large land, to a land flowing with milk and honey.
3:10	eoyb				Why did Yahweh send Moses to Pharaoh?	Yahweh sent Moses to Pharaoh so that Moses would bring Yahweh’s people, the Israelites, out of Egypt.
3:12	dtdf				What would be a sign to Moses that Yahweh was sending him?	The sign to Moses that Yahweh was sending him would be that when Moses had brought the people out of Egypt, he would worship Yahweh on this mountain.
3:14	bdxs				When the Israelites would ask Moses what God’s name is, what should he say to them?	When the Israelites would ask Moses what God’s name is, he should say, “I AM THAT I AM.”
3:18	o690				How long will the Israelites go into the wilderness in order that they may sacrifice to Yahweh, their God?	The Israelites will go three days’ journey into the wilderness in order that they might sacrifice to Yahweh, their God.
3:19	zo4m				The king of Egypt would not let the Israelites go unless what happens?	The king of Egypt would not let the Israelites go unless his hand would be forced.
4:2	hbds				What was in Moses’ hand?	A staff was in Moses’ hand.
4:4	ns41				What did Moses’ staff become when he threw it on the ground?	Moses’ staff became a snake when he threw it on the ground.
4:4	jiwf				By what should Moses take hold of the snake?	Moses should take the snake by the tail.
4:6	g6p2				When Moses first brought his hand out from inside his robe, what happened?	When Moses first brought his hand out from inside his robe, it was leprous.
4:12	qsjr				Who will be Moses’ mouth and teach him what to say?	Yahweh will be Moses’ mouth and teach him what to say.
4:14	p6cg				When Aaron sees Moses, how will he feel?	When Aaron sees Moses, he will be glad in his heart.
4:16	f5at				Like whom will Moses be to Aaron?	Moses will be like God to Aaron.
4:19	p38r				Why can Moses return to Egypt?	Moses can return to Egypt, for all the men who were trying to take his life are dead.
4:21	jdaq				Why will Yahweh harden Pharaoh’s heart?	Yahweh will harden Pharaoh’s heart so that Pharaoh will not let the people go.
4:22-23	sb7c				Since Pharaoh has refused to let Yahweh’s firstborn son go, what will Yahweh do to Pharaoh’s firstborn son?	Since Pharaoh has refused to let Yahweh’s firstborn son go, Yahweh will certainly kill Pharaoh’s firstborn son.
4:24	k4i2				When they stopped for the night, what did Yahweh try to do to Moses?	When they stopped for the night, Yahweh met Moses and tried to kill him.
4:27	llfo				Where did Aaron meet Moses?	Aaron met Moses at the mountain of God.
4:30	ahf0				Who displayed the signs of Yahweh’s power in the sight of the people?	Aaron displayed the signs of Yahweh’s power in the sight of the people.
5:1	hfeb				Why should Pharaoh let Yahweh’s people go?	They should let Yahweh’s people go so they can have a festival for him in the wilderness.
5:3	n0i8				Why should the Israelites go on a three-day journey into the wilderness and sacrifice to Yahweh their God?	The Israelites should go on a three-day journey into the wilderness and sacrifice to Yahweh their God so that he does not attack them with plague or with the sword.
5:6-7	ljrf				To whom did Pharaoh give a command to no longer give the Israelites straw to make bricks?	Pharaoh gave a command to the people’s taskmasters and foremen to no longer give the Israelites straw to make bricks.
5:11	n9mq				Although the Israelites must go and get straw wherever they can find it, what will not be reduced?	Although the Israelites must go and get straw wherever they can find it, their workload will not be reduced.
5:14	ek4y				Whom did Pharaoh’s taskmasters beat?	Pharaoh’s taskmasters beat the Israelite foremen, those same men whom they had put in charge of the workers.
5:15-16	q12s				Whose fault was it that the Israelite foremen were beaten?	It was the fault of Pharaoh’s own people that the Israelite foremen were beaten.
5:20	aaqg				Where were Moses and Aaron as they went away from Pharaoh?	Moses and Aaron were standing outside the palace as they went away from Pharaoh.
5:22	laa1				Who did Moses say caused trouble for the people of Israel?	Moses said the Lord caused trouble for the people of Israel.
6:1	mxuf				Why will Pharaoh let the people of Israel go?	Pharoah will let the people of Israel go because of Yahweh’s strong hand.
6:2	fpwg				How did Yahweh appear to Abraham, to Isaac, and to Jacob?	Yahweh appeared to Abraham, to Isaac, and to Jacob as God Almighty.
6:5	f4jz				What has Yahweh heard, and what has he called to mind?	Yahweh has heard the groaning of the Israelites whom the Egyptians have enslaved, and he has called to mind his covenant.
6:8	e8sr				What will Yahweh give to the Israelites as a possession?	Yahweh will give the land that he swore to give to Abraham, to Isaac, and to Jacob to the Israelites as a possession.
6:12	iq9a				Why does Moses think Pharaoh will not listen to him?	Moses thinks Pharaoh will not listen to him because he is not good at speaking.
6:18	ldlz				How long did Kohath live?	Kohath lived until he was 133 years old
6:20	w2r9				Whom did Amram marry?	Amram married Jochebed, his father’s sister.
6:23	lmuh				Who bore Nadab and Abihu?	Elisheba bore Nadab and Abihu.
6:26	tkcg				How should Aaron and Moses bring out the Israelites from the land of Egypt?	Aaron and Moses should bring out the Israelites from the land of Egypt by their groups of fighting men.
7:1	ry37				What has Yahweh made Moses like to Pharaoh?	Yahweh has made Moses like a god to Pharaoh.
7:3	rma9				What will Yahweh do to Pharaoh’s heart?	Yahweh will harden Pharaoh’s heart.
7:5	rt3t				When will the Egyptians know who Yahweh is?	The Egyptians will know who Yahweh is when he reaches out with his hand on Egypt and brings out the Israelites from among them.
7:9	a1y0				What will Moses’ staff become?	Moses’ staff will become a snake.
7:11	o4ry				How did the staffs of Pharaoh’s wise men and sorcerers become snakes?	The staffs of Pharaoh’s wise men and sorcerers became snakes by their magic.
7:15	btfn				Where should Moses stand to meet Pharaoh?	Moses should stand on the riverbank to meet Pharaoh.
7:17	kgjy				To what will the river be turned?	The river will be turned to blood.
7:19	z3sg				What water will turn to blood?	The Egyptians’ rivers, streams, pools and all their ponds and even the water in containers of wood and stone will be turned to blood.
7:22	hn95				What happened to Pharaoh’s heart?	Pharaoh’s heart was hardened.
7:24	ic47				How did the Egyptians try to get water to drink?	The Egyptians dug around the river for water to drink.
8:2	dh0d				What would Yahweh do if Pharaoh refused to let Yahweh’s people go?	If Pharaoh refused to let Yahweh’s people go, Yahweh would afflict all Pharaoh’s country with frogs.
8:3	rfis				Where will the frogs from the river go?	The frogs will come up and go into Egyptians’ houses, bedrooms, and beds. They will go into their servants’ houses. They will go onto the people, into their ovens, and into their kneading bowls.
8:6	s9zk				Where did Aaron reach out with his hand?	Aaron reached out with his hand over Egypt’s waters.
8:9	phof				What privilege did Moses give Pharaoh?	Moses gave Pharaoh the privilege of telling him when he should pray for Pharaoh, his servants, and his people so that the frogs may be removed from them and their houses and stay only in the river.
8:15	dcfb				What did Pharoah do after he saw that there was relief from the frogs?	When Pharaoh saw that there was relief from the frogs, he hardened his heart and did not listen to Moses and Aaron.
8:17	yqn3				What did the dust on the ground become?	All the dust on the ground became gnats throughout the whole land of Egypt.
8:18	ih39				What happened when the magicians tried with their magic to produce lice?	The magicians were not able to produce lice.
8:21	akkk				What will be full of flies?	The Egyptians’ houses will be full of swarms of flies, and even the ground on which they stand will be full of flies.
8:22	z7gr				Why will there be no flies in Goshen?	Yahweh would treat the land of Goshen differently, so that no swarms of flies would be there. This would happen so that Pharaoh would know that Yahweh is in the midst of this land.
8:25-26	udk8				Why do the Israelites not sacrifice in Egypt?	The sacrifices the Israelites make to Yahweh their God are something disgusting to the Egyptians.
8:32	o8m9				Who hardened Pharaoh’s heart after the flies left?	Pharaoh hardened his heart this time also.
9:3	brz2				On what will Yahweh’s hand be?	Yahweh’s hand will be on the Egyptians’ cattle in the fields and on the horses, donkeys, camels, herds, and flocks.
9:7	pl4a				Even after the cattle died, why did Pharaoh not let the people of Israel go?	Pharaoh’s heart was stubborn, so he did not let the people go.
9:8-9	xj5y				What will become fine dust over all the land of Egypt?	Ashes from a furnace will become fine dust over all the land of Egypt.
9:11	drim				Why could the magicians not resist Moses?	The magicians could not resist Moses because of the blisters.
9:15-16	vwio				Why did Yahweh not reach out with his hand and attack Pharaoh and his people with disease and eradicate them from the land?	Yahweh did not attack Pharaoh and his people in order to show them His power, so that His name may be spread throughout all the earth.
9:19	tj1a				What warning did Yahweh give about the hail?	Yahweh said that every man and animal that is in the field and is not brought home—the hail will come down on them, and they will die.
9:20	nw4l				Who brought their slaves and cattle into their houses?	Those of Pharaoh’s servants who believed in Yahweh’s message hurried to bring their slaves and cattle into the houses.
9:25	sjl5				Throughout all the land of Egypt, what did the hail strike?	Throughout all the land of Egypt, the hail struck everything in the fields, both people and animals. It struck every plant in the fields and broke every tree.
9:27	dl7y				During the hail, what did Pharaoh admit?	He said he has sinned this time. He said that Yahweh is righteous, and that he and his people are wicked.
9:32	imsx				What plants were not harmed by the hail? Why?	The wheat and the spelt were not harmed, because they were later crops.
10:1-2	dvpa				Why did Yahweh harden the hearts of Pharaoh and his servants?	Yahweh hardened the hearts of Pharaoh and his servants to show these signs of his power among them. He also did this so that the Israelites might tell their children and grandchildren the things he has done.
10:5	uito				What insect will cover the surface of the ground so that no one will be able to see the earth?	Locusts will cover the surface of the ground so that no one will be able to see the earth.
10:9-11	r1cn				What did Pharaoh say when Moses told him the Israelites will go with their young and with their old, with their sons and their daughters?	Pharaoh said, “No! Go, just the men among you.”
10:13	eqio				What brought the locusts?	The east wind brought the locusts.
10:16	sjsa				What did Pharaoh say he has done against Yahweh?	Pharaoh said he has sinned against Yahweh, Moses’ God.
10:19	z4r7				How many locusts remained in all the territory of Egypt after Yahweh brought a very strong west wind?	Not a single locust remained in all the territory of Egypt after Yahweh brought a very strong west wind.
10:22	amf9				What happened to the Egyptians during the three days of darkness?	During the three days of darkness, no one could see anyone else; no one left his home for three days.
10:24	y0vm				After the darkness, what did Pharaoh say must remain behind when the Israelites go to worship Yahweh?	Pharaoh said the flocks and herds must remain behind when the Israelites go to worship Yahweh.
10:28	f0cg				What did Pharaoh say would happen to Moses if Moses would see Pharaoh's face again?	Pharaoh said that on the day Moses would see his face, Moses would die.
11:1-2	wxgb				For what should every Israelite man and woman ask of his or her neighbor after the final plague?	Every Israelite man and woman should ask of his or her neighbor for jewels of silver and jewels of gold after the final plague.
11:3	uty1				In the sight of whom was Moses very impressive?	Moses was very impressive in the sight of Pharaoh’s servants and the people of Egypt.
11:5	xa6z				Which of the firstborn would die?	All the firstborn in the land of Egypt would die, from the firstborn of Pharaoh, who sits on his throne, to the firstborn of the slave girl who is behind the mill, and to all the firstborn of the animals.
11:6	i1t3				When has there been such a great cry throughout all the land of Egypt like the one caused by the last plague?	There has never been such a great cry, nor ever will there be again.
12:3	gtgb				What must each Israelite family do on the tenth day of this first month?	On the tenth day of this month each family must take a lamb or young goat for themselves.
12:4	t8r8				If the household is too small for a lamb, what should they do?	If the household is too small for a lamb, the man and his next door neighbor are to share a lamb or young goat so that the meat will be enough for the number of the people.
12:6	w9cr				When must the whole assembly of Israel kill these animals?	The whole assembly of Israel must kill these animals at twilight on the fourteenth day of this month.
12:8	ym84				With what must the Israelites eat the lamb or goat?	They must eat it with bread made without yeast, along with bitter herbs.
12:10	n142				What must the Israelites do if any of the lamb is left over?	They must not let any of it be left over until morning. They must burn whatever is left over in the morning.
12:13	b8u4				What will happen when Yahweh sees the blood on the houses?	When Yahweh sees the blood, he will pass over them, and the plague will not be on them.
12:15	t35u				What must happen to whoever eats leavened bread from the first day until the seventh day?	Whoever eats leavened bread from the first day until the seventh day, that person must be cut off from Israel.
12:16	mvij				What is the only work the Israelites can do during the seven days of unleavened bread?	No work will be done on these days except the cooking for everyone to eat.
12:18	r5cg				When must the Israelites eat unleavened bread?	The Israelites must eat unleavened bread from twilight of the fourteenth day in the first month of the year until twilight of the twenty-first day of the month.
12:22	niz8				Where should the Israelites apply the blood in the basin?	The Israelites should apply the blood in the basin to the top of the door frame and the two doorposts.
12:23	c9xb				When will Yahweh pass over someone’s door?	Yahweh will pass over someone’s door when he sees the blood on the top of the doorframe and on the two doorposts.
12:26-27	cswy				What were the Israelites to say to their children when their children asked them why they were doing that serice?	The Israelites were tell their children that their service was a sacrifice of Yahweh’s Passover, because Yahweh passed over the Israelites’ houses in Egypt when he attacked the Egyptians and rescued their households.
12:30	yafb				Why was there was a great outcry in Egypt?	There was a great outcry in Egypt, for there was not a house where there was not someone dead.
12:35	kz1g				For what did the Israelites ask the Egyptians?	The Israelites asked the Egyptians for jewels of silver, jewels of gold, and clothing.
12:39	u7uu				Why was the bread without yeast?	The bread was without yeast because the Israelites had been driven out of Egypt and could not delay to prepare food.
12:41	neef				How long had the Israelites been in Egypt?	They had been in Egypt 430 years.
12:43	bgck				Who may not share in eating the Passover?	No foreigner may share in eating the Passover.
12:48	vn5h				If a foreigner lives with the Israelites and wants to observe the Passover for Yahweh, what must all his male relatives do?	If a foreigner lives with the Israelites and wants to observe the Passover for Yahweh, all his male relatives must be circumcised.
13:1-2	ndkg				To whom were the firstborn to be set apart?	The firstborn were to be set apart to Yahweh.
13:4	be38				In what month did the Israelites go out of Egypt?	The Israelites went out of Egypt in the month of Aviv.
13:9	mk7g				Why will this rescue become reminders for the Israelites on their hands and reminders on their forehead?	This rescue will become reminders for the Israelites on their hands and reminders on their forehead so that Yahweh’s law may be in their speech.
13:13	ps23				With what must the Israelites buy back every firstborn donkey?	Every firstborn donkey the Israelites must buy back with a lamb.
13:17	mt2e				Why did God not lead the Israelites by way of the land of the Philistines?	God did not lead them by way of the land of the Philistines, for God said, “Perhaps the people will change their minds when they experience war and will then return to Egypt.”
13:19	vqzd				What had Joseph made the Israelites solemnly swear?	Joseph had made the Israelites solemnly swear, “You must carry away my bones with you”.
13:21	rqfm				How did Yahweh go before the Israelites by night? Why?	By night he went in a pillar of fire to give them light. In this way they could travel by day and by night.
14:5	g8bu				When the king of Egypt was told that the Israelites had fled, what happened to the minds of Pharaoh and his servants?	When the king of Egypt was told that the Israelites had fled, the minds of Pharaoh and his servants turned against the Israelites.
14:9	cjzq				Where did the Egyptians overtake the Israelites?	The Egyptians overtook the Israelites camping by the sea above Pi Hahiroth, before Baal Zephon.
14:12	kpdx				What did the Israelites say would have been better than to die in the wilderness?	They said it would have been better for them to work for the Egyptians than to die in the wilderness.
14:14	bp0p				Because Yahweh will fight for the Israelites, what will they have to do?	Yahweh will fight for the Israelites, and they will only have to be quiet.
14:17	qwrk				Why will the Egyptians go after the Israelites into the sea?	Yahweh will harden the Egyptians’ hearts so they will go after the Israelites.
14:20	zb7f				How did the cloud hinder the Egyptians but help the Israelites?	The cloud was a dark cloud to the Egyptians, but it lit the night for the Israelites, so one side did not come near the other all night.
14:21	puyl				For how long did Yahweh drive the sea back by a strong east wind?	Yahweh drove the sea back by a strong east wind all that night.
14:24	tpkv				When did Yahweh look down on the Egyptian army through the pillar of fire and cloud?	In the early morning hours, Yahweh looked down on the Egyptian army through the pillar of fire and cloud.
14:28	o7cg				How many soldiers of Pharaoh’s army survived crossing the sea?	Not one of Pharaoh's soldiers survived crossing the sea.
14:31	ezvq				What did Israel do when they saw the great power that Yahweh used against the Egyptians?	When Israel saw the great power that Yahweh used against the Egyptians, the people honored Yahweh, and they trusted in Yahweh and in his servant Moses.
15:1	i1tj				Whom has Yahweh thrown into the sea?	Yahweh has thrown the horse and its rider into the sea.
15:5	em27				How did the Egyptians go down into the depths?	They went down into the depths like a stone.
15:8	musk				How were the waters piled up?	By the breath of Yahweh’s nostrils the waters were piled up.
15:13	ci8q				In what has Yahweh led the people he rescued?	In his covenant faithfulness, Yahweh has led the people he has rescued. In his strength he has led them to the holy place where he lives.
15:14	yn7h				What will the people do when they hear of Yahweh rescuing the Israelites?	The peoples will hear, and they will tremble.
15:17	bha7				Where will Yahweh bring the Israelites?	Yahweh will bring the Israelites and plant them on the mountain of his inheritance, the place Yahweh has made to live in.
15:20	x36u				Who played tambourines?	Miriam the prophetess and all the women played tambourines.
15:23	isqd				Why could the Israelites not drink the water at Marah?	The Israelites could not drink the water at Marah because it was bitter.
15:25	j29t				How did the bitter water at Marah become sweet?	Yahweh showed Moses a tree. Moses threw it into the water, and the water became sweet to drink.
16:1	t9r1				Where is the Wilderness of Sin?	The Wilderness of Sin is between Elim and Sinai.
16:3	s98t				According to the Israelites, why did Moses bring them out into the wilderness?	They said Moses brought them out into this wilderness to kill their whole community with hunger.
16:4	iie7				Why will the people go out and gather a day’s portion every day?	The people will go out and gather a day’s portion every day so that Yahweh may test them to see whether or not they will walk in his law.
16:8	e94i				How will the Israelites know Yahweh has brought them out from the land of Egypt?	The Israelites will know Yahweh has brought them out from the land of Egypt when Yahweh gives them meat in the evening and bread in the morning to the full.
16:10	p78g				What appeared in the cloud?	Yahweh’s glory appeared in the cloud.
16:14-15	rdid				What size was the bread that Yahweh has given the Israelites to eat?	The bread that Yahweh has given the Israelites to eat was small flakes as thin as frost.
16:18	vxca				When the Israelites measured the bread from Yahweh, how much did each person have?	When they measured it with an omer measure, those who had gathered much had nothing over, and those who had gathered little had no lack. Each person gathered enough to meet their need.
