Reference	ID	Tags	Quote	Occurrence	Question	Response
41:4	outa				In Pharaoh’s first dream, what did the seven thin cows do to the seven fat cows?	The seven thin cows ate the seven fat cows.
41:7	yi6a				In Pharaoh’s second dream, what did the seven thin ears of grain do to the seven full ears?	The seven thin ears swallowed up the seven full ears.
41:8	ys4z				How did the magicians and wise men of Pharaoh interpret his dreams?	The magicians and wise men of Pharaoh could not interpret Pharaoh’s dreams.
41:12-13	gt1r				What did the chief cupbearer tell Pharaoh about Joseph?	The chief cupbearer told Pharaoh that a young Hebrew man had correctly interpreted his dream and the dream of another fellow when they were in custody.
41:16	vbss				Who did Joseph say would interpret Pharaoh’s dream?	Joseph said that God would answer Pharaoh’s dream with favor.
41:25	k58u				What did Joseph say God was declaring to Pharaoh?	Joseph said that God was declaring to Pharaoh what God was about to do.
41:26	hdbh				What did the seven good cows and the seven good heads in the dreams represent?	The seven good cows and heads represented seven years of abundance.
41:27	ivyn				What did the seven thin cows and the seven thin heads in the dreams represent?	The seven thin cows and heads represented seven years of famine.
41:32	lh3c				According to Joseph, why was Pharaoh given two dreams?	Pharaoh was given two dreams because the matter had been established by God, and God would soon do it.
41:34	njle				What fraction of the crops of Egypt did Joseph advise Pharaoh to take in the seven abundant years	Joseph advised Pharaoh appoint a man to take a fifth of the crops in the seven abundant years.
41:38	nt5z				What did Pharaoh say was in Joseph?	Pharaoh said that the Spirit of God was in Joseph.
41:40-41	w7he				What position of authority did Pharaoh give Joseph?	Pharaoh gave Joseph authority over Pharaoh’s house and over all the land of Egypt, second only to Pharaoh.
41:48-49	sk5n				How much grain did Joseph store up in the seven years of abundance?	Joseph stored up grain like the sand of the sea, an amount beyond counting.
41:50-52	b7f8				What were the names of Joseph’s two sons born before the famine?	Joseph’s sons were named Manasseh and Ephraim.
41:54	hmob				How widespread was the seven years of famine?	The seven years of famine was in all lands.
41:55-56	ubqz				What did Joseph do when the people of Egypt cried to Pharaoh for food?	Joseph opened all the storehouses and sold food to the Egyptians.
41:57	r5ul				Who came to Egypt to buy grain from Joseph?	All the earth came to Egypt to buy grain from Joseph.
42:1-4	k60o				Who did Jacob send down to Egypt to buy grain?	Joseph’s ten brothers, without Benjamin, went down to Egypt to buy grain.
42:6	r1sj				What did Joseph’s brothers do when they came to Joseph to buy grain?	Joseph’s brothers bowed down to him with their faces to the ground.
42:7	jzjk				What did Joseph do when he recognized his brothers?	Joseph disguised himself and spoke harshly with his brothers.
42:9	ivrj				What accusation did Joseph make against his brothers?	Joseph accused his brothers of being spies.
42:13	h6xd				Where did Joseph’s brothers say their youngest brother was?	Joseph’s brothers said their youngest brother was with his father in the land of Canaan.
42:13	jh7f				Where did Joseph’s brothers say their other missing brother was?	Joseph’s brothers said their other missing brother was no longer alive.
42:15	rvyw				What test did Joseph give his brothers to demonstrate they were not spies?	Joseph said the brothers would not leave Egypt, unless their youngest brother came to Egypt.
42:17	utsk				Where did Joseph put the brothers and for how long?	Joseph put the brothers in custody for three days.
42:18-20	mytp				What did Joseph tell the brothers to do in order to live?	Joseph told them to let one of the brothers be confined in prison, while the others carried grain to Canaan and brought back the youngest brother.
42:21-22	g9us				Why did Joseph’s brothers believe this trouble had come upon them?	They believed that the blood of Joseph was being required of them for what they had done to Joseph.
42:24	n6wt				What did Joseph do when he heard his brothers talk about what they had done to him?	When Joseph heard his brothers talking about what they had done to him, Joseph turned from them and wept.
42:25	vpai				What did Joseph have put back in each brother’s sack?	Joseph had each brother’s money put back in his sack.
42:28	y32q				How did the brothers react when they learned that one brother’s sack had his money in it?	Their hearts sank and they spoke trembling to one another.
42:28	h5yx				Who did the brothers blame for their current problems?	The brothers blamed God, asking why God had done this to them.
42:35	j8r0				What did the brothers and Jacob learn when they emptied all the sacks?	They learned that every man’s money was in his sack.
42:36	suqs				What was Jacob afraid would happen because of their situation?	Jacob was afraid that Simeon and Benjamin would be taken away from him.
42:37	v86k				What oath did Reuben make to Jacob?	Reuben swore to bring Benjamin back to Jacob from Egypt; otherwise, Reuben’s two sons could be killed.
42:38	ihf1				Did Jacob allow Reuben to take Benjamin to Egypt?	No, Jacob did not allow Reuben to take Benjamin to Egypt.
42:38	lbw0				What did Jacob say would happen to him if Benjamin died?	Jacob said he would go down with sorrow to Sheol if Benjamin died.
43:1-2	svr0				Why did Israel tell his sons to go again and buy some food in Egypt?	The famine was severe and they had eaten the grain they had brought from Egypt on the first journey.
43:3-5	eicd				What did Judah say they must have in order to go down to Egypt again?	Judah said they must have their brother Benjamin in order to go down to Egypt.
43:9	nzws				What oath did Judah make to Israel his father?	Judah said that if he did not bring Benjamin back, he would bear the blame forever.
43:11-12	lprn				What did Israel tell the brothers to take with them to Egypt?	Israel told the brothers to take some of the best products of the land, and to take double the money.
43:14	mkqk				For what did Israel ask God regarding the journey?	Israel asked God to give the brothers mercy in Egypt, so that all the brothers would be released.
43:18	zp2d				How did the brothers respond when they were brought to Joseph’s house, and why?	The brothers were afraid they would be arrested and taken as slaves because of the money left in their bags on the first journey.
43:21-22	oow9				What did the brothers tell the steward of Joseph’s house?	The brothers told the steward they had brought back the money left in their sacks, and money to buy food.
43:23	eway				From where did the steward say the money left in their sacks had come?	The steward said the money left in their sacks had come from their God.
43:26	ewuz				What did the brothers do when Joseph came home?	The brothers brought the gifts into the house, and bowed down before Joseph to the ground.
43:27	xx4d				About whom did Joseph ask the brothers?	Joseph asked the brothers about the welfare of their father.
43:30	eg7c				Why did Joseph hurry to go out of the room, and what did he do after he left?	Joseph hurried out of the room because he was deeply moved about Benjamin, and he went to his room and wept.
43:32	vdba				Why did the Egyptians and the Hebrews eat separately?	It was detestable to the Egyptians to eat with the Hebrews.
43:33	mn34				How were the brothers arranged at the table?	The brothers were arranged at the table according to their birthright and age.
43:34	s8g4				What was unusual about the portions of food the brothers received?	Benjamin’s portion was five times as much as any of his brothers.
44:1-2	pqsq				What did Joseph tell his steward to do with the brothers’ sacks before they left?	Joseph told his steward to fill the brothers’ sacks with food, to put their money in the sacks, and to put his silver cup in the youngest’s sack.
44:4-5	wl63				Basically what did Joseph tell the steward say to the brothers when he overtook them outside the city?	Joseph told the steward to ask them why they had returned evil for good and accused them of stealing Joseph’s cup.
44:9	e6pl				What did the brothers swear they would do if any one of them had stolen Joseph’s cup?	The brothers said the one found with the cup would die, and the others would become slaves.
44:10	i9a5				What punishment did the steward say he would require if the cup was stolen?	The steward said that the one with whom the cup was found would be his slave, and the others would be innocent.
44:12-13	qarb				What did the steward find, and how did the brothers react?	The steward found the cup in Benjamin’s sack, and the brothers tore their clothes.
44:14	sovu				What did the brothers do when they came back to Joseph in his house?	The brothers bowed before Joseph to the ground.
44:16	y584				Who did Judah say had found out the iniquity of the brothers?	Judah said that God had found out their iniquity.
44:16	idsy				What did Judah say all the brothers would now become?	Judah said all the brothers would now become Joseph’s slaves.
44:17	b7n4				What punishment did Joseph say he would require of the brothers?	Joseph said that the man in whose hand the cup was found would be his slave, and the rest could go in peace.
44:20	ih56				What reasons did Judah give for why his father loved the youngest brother?	Judah said that the youngest brother was the child of his father’s old age, and the only child left of his mother.
44:22	dadt				What did the brothers worry would happen to their father if the youngest left him?	The brothers worried their father would die if the youngest left him.
44:23	tzsq				Why did Judah say the brothers were forced to bring Benjamin with them to Egypt?	Judah said they were forced to bring Benjamin because Joseph had said that unless the youngest brother comes, they would not see Joseph’s face.
44:26	b4rk				Why did Judah say the brothers were forced to bring Benjamin with them to Egypt?	Judah said they were forced to bring Benjamin because Joseph had said that unless the youngest brother comes, they would not see Joseph’s face.
44:28	ygvv				What did Israel think had happened to Joseph?	Israel thought that surely Joseph had been torn in pieces.
44:29	da96				What did Israel say would happen to him if Benjamin were taken from him?	Israel said that the brothers would bring his gray hair with sorrow to Sheol.
44:31	b9qq				What did Judah say would happen to his father if they returned without Benjamin?	Judah said that his father would die.
44:32	xl7l				What guarantee for Benjamin did Judah say he had become?	Judah said that if he did not return Benjamin to his father, he would bear the guilt forever.
44:33	rakk				What did Judah ask Joseph to do so that Benjamin could return to his father?	Judah asked Joseph to make him Joseph’s slave, so that Benjamin could return to his father.
45:1-2	vjzg				What did Joseph do as he made himself known to his brothers, which the Egyptians heard?	Joseph wept loudly as he made himself known to his brothers.
45:3	l7me				How did the brothers react when Joseph revealed himself to them?	The brothers could not answer Joseph for they were shocked.
45:7	ricf				According to Joseph, why did God sent Joseph to Egypt?	God sent Joseph to Egypt to preserve life, and to preserve his family as a remnant in the earth.
45:8	reup				What had God made Joseph in the land of Egypt?	God had made Joseph father to Pharaoh, lord of all Pharaoh’s house, and ruler over all the land of Egypt.
45:9-11	s4ko				How did Joseph plan to take care of his family?	Joseph told his family to come and live in the land of Goshen where he would provide for them.
45:13	qe8z				What did Joseph tell his brothers to hurry and do?	Joseph told his brothers to hurry and bring his father to Egypt.
45:16-18	xmhl				How did Pharaoh react when he heard that Joseph’s brothers had come to Egypt?	Pharaoh was very pleased, and he told Joseph to tell his brothers to bring their father and their households to live in the good of the land of Egypt.
45:21-23	ti5u				Who received extra gifts and provisions for the trip?	Benjamin received three hundred pieces of silver and five changes of clothing, and Israel received twenty loaded donkeys.
45:26	kaqh				How did Israel react when he heard that Joseph was alive and ruler over all the land of Egypt?	Israel’s heart was astonished, for he did not believe the brothers when they told him.
45:28	bsa2				What did Israel say he wanted to do before he died?	Israel said he wanted to see Joseph before he died.
46:1	jfiu				What did Israel do in Beersheba?	Israel offered sacrifices to the God of his father Isaac.
46:3-4	gsbf				What promises did God make to Israel in Beersheba?	God promised to make Israel a great nation, to go with Israel to Egypt, to bring Israel up again from Egypt, and to have Joseph close his eyes.
46:5-7	lfw9				Who went to Egypt with Israel?	Israel and all his descendants with him went to Egypt.
46:12	dt3j				Which two sons of Judah died in the land of Canaan?	Er and Onan died in the land of Canaan.
46:27	elp4				How many persons of the house of Jacob came to Egypt?	Seventy persons of the house of Jacob came to Egypt.
46:29	qcpe				What did Joseph do to meet his father?	Joseph went up with his chariot and met his father Israel in Goshen.
46:29	rrlq				What did Joseph do when he saw his father?	Joseph hugged his father’s neck and wept a long time.
46:34	stz9				What did Joseph tell the brothers to say to Pharaoh concerning their occupation?	The brothers were to tell Pharaoh that they were keepers of cattle from their youth.
47:3	wf9d				What did the five brothers of Joseph tell Pharaoh their occupation was?	The five brothers told Pharaoh their occupation was shepherding.
47:4	rbnr				What kind of residents did the brothers say they were in the land of Egypt?	The brothers said they were temporary residents in the land of Egypt.
47:6	x1ec				What did Pharaoh tell Joseph to do with Joseph’s family?	Pharaoh told Joseph to settle Joseph’s family in the best region, the land of Goshen.
47:7	m77l				What did Jacob do for Pharaoh when he met him and when he went out from his presence?	Jacob blessed Pharaoh when he met him and when he went out from his presence.
47:9	d5x1				How long had Jacob lived when he met Pharaoh?	Jacob had lived one hundred and thirty years.
47:9	bi7w				How long did Jacob say his life was compared to his ancestors?	Jacob said his life was not as long as his ancestors’ lives.
47:10	wbk4				What did Jacob do for Pharaoh when he met him and when he went out from his presence?	Jacob blessed Pharaoh when he met him and when he went out from his presence.
47:14	q7t6				What was Joseph able to do by selling grain?	Joseph was able to gather up all the money in the land of Egypt and in the land of Canaan.
47:16-17	zln0				What was Joseph then able to do by exchanging food with the Egyptians?	Joseph was able to exchange food for all the livestock of the Egyptians.
47:18-19	cm9d				After the money and livestock were all given to Pharaoh in exchange for food what did the people of Egypt offer Pharaoh in exchange for more food?	The people of Egypt offered their land and themselves as servants of Pharaoh in exchange for more food.
47:24	lspq				What part of the whole harvest did Joseph require to be given to Pharaoh?	Joseph required one fifth of the harvest to be given to Pharaoh.
47:27	cwqh				In what ways did the people of Israel prosper in the land of Egypt?	The people of Israel gained possessions in the land of Egypt, and they were fruitful and multiplied rapidly.
47:28	f5jm				At what age did Jacob die?	Jacob died at the age of one hundred forty-seven.
47:30	tm45				What did Israel ask Joseph to swear he would do?	Israel asked Joseph to swear he would bury Israel in his forefathers’ burial place.
48:1	g27d				What message did Joseph hear about his father, and what did he then do?	Joseph heard that his father was sick, so he took with him his two sons.
48:4	jlho				What promises from God did Jacob recall to Joseph?	Jacob recalled that God promised him he would be fruitful and multiply, he would be made an assembly of nations, and the land of Canaan would be an everlasting possession of his descendants.
48:5-6	u0vp				How did Jacob say he would consider the two sons of Joseph in the inheritance?	Jacob said he would consider the two sons of Joseph as his own.
48:8-10	jbh5				Why did Israel not recognize Joseph’s two sons?	Israel did not recognize Joseph’s two sons because his eyes were failing because of his age.
48:14	dod2				Who was the first-born of Joseph’s sons?	Manasseh was the first-born of Joseph’s sons.
48:14	b0kh				Upon whom did Israel put his right hand, and upon whom his left hand?	Israel put his right hand on Ephraim, and his left hand on Manasseh.
48:17-18	gp11				Why did Joseph try to exchange the position of Israel’s hands?	Joseph expected Israel’s right hand to be on Manasseh because he was the first-born.
48:19	py7h				Why did Israel refuse to exchange the position of his hands on the two sons of Joseph?	Israel refused because the younger brother would be greater than the first-born.
48:20	peeq				What blessing did Israel say the people of Israel would pronounce?	Israel said the people of Israel would pronounce the blessing, “May God make you like Ephraim and like Manasseh”.
48:21	xk4i				What did Israel say would happen to Joseph?	Israel said that Joseph would be brought back to the land of his fathers.
49:1	rpv1				For what reason did Jacob gather his sons together?	Jacob gathered his sons together to tell them what would happen to them and their descendants in the future.
49:3	japp				What positive attributes did Reuben have?	Reuben was outstanding in dignity and power.
49:4	oogg				Why would Reuben not have the pre-eminence even though he was the firstborn?	Reuben would not have the pre-eminence because he defiled his father’s bed.
49:7	qele				What did Jacob curse about Simeon and Levi?	Jacob cursed the fierce and cruel anger of Simeon and Levi.
49:8	dy1e				What did Jacob say his other sons would do before Judah?	Jacob said his others sons would bow down before Judah.
49:10	f7jq				What promises about the future were made to Judah?	Judah was promised that the sceptre would not depart from him until Shiloh came, and that the nations would obey him.
49:13	tg53				Where did Jacob say the descendants of Zebulun would live?	Jacob said the descendants of Zebulun would live by the shore of the sea.
49:17	gilo				What animal did Jacob say Dan would be like?	Jacob said Dan would be like a poisonous snake.
49:20	p7x3				For what did Jacob say Asher would be known?	Jacob said Asher would be known for providing royal delicacies.
49:22	dsl0				What kind of plant did Jacob say Joseph would be like?	Jacob said Joseph would be like a fruitful bough whose branches climb over a wall.
49:24	wi0m				Who did Jacob say would keep Joseph’s bow steady and his hands skillful?	Jacob said the hands of the mighty one of Jacob, the Rock of Israel would keep Joseph’s bow steady and his hands skillful.
49:31	e8xo				Who was already buried in the place where Jacob wished to be buried?	Abraham, Sarah, Isaac, Rebekah, and Leah were already buried there.
49:33	v7d9				What did Jacob do after he gave his blessings and instructions to his sons?	Jacob breathed his last and went to his people.
50:2-3	yc9d				What did Joseph do with Israel’s body after Israel died?	Joseph had Israel’s body embalmed.
50:4-6	fu39				What request did Joseph make to Pharaoh about the burial of his father, and why did he make this request?	Joseph requested to be able to go to the land of Canaan to bury his father, as his father had made him swear.
50:7-9	ynuu				Who went with Joseph to bury Israel?	All the officials of Pharaoh, the courtiers of his household, the senior officials of Egypt, Joseph’s household, Joseph’s brothers, his father’s household, and chariots and horsemen all went with Joseph.
50:11	o684				What did the Canaanites say when they saw Joseph and those with him?	The Canaanites said that this was a very sad occasion for the Egyptians.
50:14	d61t				Where did Joseph and his brothers go after burying their father?	Joseph and his brothers returned into Egypt.
50:15	fuaw				About what were Joseph’s brothers worried after Israel died?	Joseph’s brothers were worried that Joseph would repay them for all the evil the brothers had done to Joseph.
50:17	e6ks				What did the brothers ask Joseph to do regarding the wrongs they had committed against Joseph?	The brothers asked Joseph to forgive them for the wrongs they had committed against Joseph.
50:18	nfil				What did Joseph’s brothers do when they came to Joseph?	When they came to Joseph, Joseph’s brothers fell down before him.
50:20	feb9				What good did Joseph say God had worked through the evil deeds of his brothers?	Joseph said God had worked the good of preserving the lives of many people.
50:22	o2ac				How long did Joseph live?	Joseph lived one hundred and ten years.
50:24	a7nq				What did Joseph say was about to happen to him?	Joseph said that he was about to die.
50:24	giv9				What promise did Joseph say God would fulfill for Israel’s descendants?	Joseph said God would come to the people and lead them up to the land God promised to Abraham, Isaac, and Jacob.
50:25	tgyb				What did Joseph make the people of Israel swear they would do?	Joseph made them swear they would carry Joseph’s bones from Egypt when they left Egypt.
50:26	vqrx				What happened to Joseph’s body after he died?	Joseph’s body was embalmed and put in a coffin in Egypt.
