Reference	ID	Tags	Quote	Occurrence	Question	Response
1:1	i4zd				What did God create in the beginning?	God created the heavens and the earth.
1:2	hxnl				What was the Spirit of God doing in the beginning?	The Spirit of God was moving above the surface of the waters.
1:3	yzts				How did God create light?	God said, “Let there be light”.
1:7-8	op7t				What did God make on the second day?	God made the sky between the expanses of water.
1:10	mv7g				What did God call the dry land and the gathered waters?	God called the dry land “earth,” and the gathered waters he called “seas.”
1:11-12	nc8q				What living things did God make on the third day?	God made plants, fruit trees, and vegetation on the third day.
1:14	kh88				What is the purpose of the lights in the sky?	They are to divide the day from the night, and as signs for seasons, for days and years.
1:16	mgsa				What did God make on the fourth day?	God made the two great lights and the stars.
1:21	next				What did God make on the fifth day?	God made the living creatures of the water, and birds.
1:22	yzpe				What command did God give the sea creatures and birds?	Be fruitful, and multiply.
1:26	gfpf				What did God make in his image?	God made man in his image.
1:26	j7tv				Over what things was man given dominion?	God gave man dominion over the fish of the sea, over the birds of the sky, over the livestock, over all the earth, and over every creeping thing that creeps upon the earth.
1:27	zj7a				What was different about how God made man?	God created man in his own image.
1:28	jh4n				What command did God give man?	Be fruitful and multiply, fill the earth and subdue it.
1:29	utrp				What did God give man to eat?	God gave them every plant yielding seed and every tree with fruit.
1:31	bkv3				When God saw everything that he had made, what did he think about it?	God thought it was very good.
2:2-3	e07v				What did God do on the seventh day?	He rested from all his work, and he blessed and sanctified the day.
2:6	aeiq				Before Yahweh caused it to rain, how was the earth watered?	A mist went up from the earth.
2:7	be0g				How did Yahweh make man?	Yahweh formed man from the dust of the ground and breathed the breath of life into him.
2:8	knt5				Where did Yahweh first put the man?	In the garden in Eden.
2:9	sx2v				What two trees were in the midst of the garden?	The tree of life and the tree of the knowledge of good and evil.
2:15	oslv				What was the man to do in the garden?	He was to work and maintain the garden.
2:16-17	suff				What command did Yahweh give the man about what to eat?	You may freely eat from every tree in the garden, except the tree of the knowledge of good and evil.
2:17	mgve				What did Yahweh say would happen if the man violated this command?	In the day when the man violated the command, he would surely die.
2:18	aqbq				What did Yahweh say was not good?	He said it was not good that the man was alone.
2:19	wtq6				What did Yahweh have the man do with every living creature?	The man gave every living creature a name.
2:20	rzis				What was not found among all the living creatures?	A helper for the man corresponding to him.
2:22	ao3f				How did Yahweh make the woman?	Yahweh caused the man to sleep and took one of the man’s ribs, and made the woman from the rib.
2:23	goh1				Why did the man call her “woman”?	Because she was taken out of the man.
2:24	lk7u				How do a man and woman become one flesh?	The man is united to the woman as his wife.
2:25	cdnj				Were the man and his wife ashamed of being naked?	No.
3:1	o2a7				What was the first question that the serpent asked the woman?	The serpent asked the woman, “Has God really said, ‘You must not eat from any tree of the garden’”?
3:4	m1ii				When the woman said God told them they would die if they ate from the tree in the middle of the garden, what did the serpent say?	The serpent said, “You will surely not die”.
3:5	sy1i				What did the serpent say would happen to the man and woman if they ate of the fruit?	The serpent said they would be like God, knowing good and evil.
3:6	vj2q				What attracted the woman to the fruit of the tree?	She saw it was good for food, a delight to the eyes, and desirable to make one wise.
3:6	t4vf				Who ate of the fruit?	The woman ate, and gave some to her husband who also ate.
3:7	jx3e				What happened to them when they ate of the fruit?	When they ate, their eyes were opened and they knew that they were naked.
3:8	rpas				What did the man and woman do when God came into the garden?	They hid themselves from God.
3:10	qg1v				Why did the man hide himself from God when he came into the garden?	The man hid himself from God because he was naked and therefor afraid.
3:12	pdzg				Who did the man say was responsible for giving him the fruit?	The man said the woman was responsible.
3:13	i7px				Who did the woman say was responsible for giving her the fruit?	The woman said that the serpent was responsible.
3:15	ycko				What kind of relationship did God say he would cause to exist between the serpent and the woman?	God said he would cause them to hate each other.
3:16	sdzi				What curse did God give the woman regarding childbirth?	God greatly multiplied the woman’s pain in childbirth.
3:17	pvbu				What curse did God give the man regarding his work?	God cursed the ground so that only by painful toil would the man eat from it.
3:20	ip5m				What name did the man give the woman, and why?	The man called the woman Eve, because she was the mother of all living things.
3:21	sh4y				What did God make for Adam and Eve, and why?	God made them garments of skins in order to clothe them.
3:22	dgha				Why did God say that now Adam must not eat of the tree of life?	God said that since Adam now knew good and evil he must not eat of the tree of life, because he would then live forever.
3:24	w4mi				What did God do to prevent Adam from eating from the tree of life?	God drove the man out of the garden and placed cherubim there to guard the way to the tree of life.
4:2	hvck				What work did Cain and Abel do?	Cain worked the soil, and Abel was a shepherd.
4:3	zng3				What offering did Cain bring to Yahweh?	Cain brought some of the fruit of the ground.
4:4	spqa				What offering did Abel bring to Yahweh?	Abel brought some of the firstborn of his flock and some of the fat.
4:4-5	fsdk				How did Yahweh respond to the offerings of Cain and Abel?	Yahweh accepted Abel’s offering, but did not accept Cain’s offering.
4:5	dpza				How did Cain react?	Cain was very angry, and his face looked dejected.
4:7	rwzz				What did Yahweh tell Cain he needed to do in order to be accepted?	Yahweh told Cain to do what is right and he would be accepted.
4:8	nvrb				Later, what happened with Cain and Abel in the field?	Cain rose up and killed Abel.
4:9	lkqj				When Yahweh asked Cain where his brother was, what did Cain say?	Cain said, “I do not know. Am I my brother’s keeper”?
4:12	sxes				What was God’s curse on Cain?	Cain’s curse was that the earth would not yield its strength to him, and he would be a fugitive and wanderer.
4:15	l7zo				What did Yahweh do to make sure no one killed Cain?	Yahweh put a mark on Cain.
4:16	tgdd				Where did Cain go to live?	Cain lived in the land of Nod, east of Eden.
4:19	gocu				Cain’s descendant Lamech had how many wives?	Lamech had two wives.
4:23	ky2y				What did Lamech tell his wives he had done?	Lamech told his wives that he had killed a man.
4:25	ssri				What was the name of another son born to Adam and Eve?	Another son of Adam and Eve was named Seth.
4:26	t19n				What did people begin to do in the days of Seth’s son Enosh?	People began to call upon the name of Yahweh.
5:1	fl8q				Of what is chapter five of Genesis a record?	Chapter five of Genesis is a record of the descendants of Adam.
5:1	visf				In whose likeness was mankind made?	Mankind was made in God’s likeness.
5:2	c05d				What genders of mankind did God create?	God created mankind male and female.
5:5	bfwb				How long did Adam live?	Adam lived 930 years.
5:8	fzjq				How long did Seth live?	Seth lived 912 years.
5:14	rhm3				How long did Kenan live?	Kenan lived 910 years.
5:20	gkv0				How long did Jared live?	Jared lived 962 years.
5:24	f1dr				What was Enoch’s relationship with God, and what happened to him?	Enoch walked with God, and God took him.
5:29	pwn6				What did Lamech say about his son Noah?	Lamech said that Noah would give mankind rest from the work and the toil caused by the ground that Yahweh had cursed.
5:32	wxqh				Who were the sons of Noah?	The sons of Noah were Shem, Ham, and Japheth.
6:2	cp29				When mankind multiplied on the earth, what did the sons of God do?	The sons of God took for themselves wives from the daughters of mankind.
6:3	lazh				What did God now say about the length of life for mankind?	God said that mankind would live 120 years.
6:4	yflr				Who were the mighty men of old, the men of renown?	The mighty men of old were giants born from the marriage of the sons of God with the daughters of men.
6:5	p8hr				What did Yahweh see in the hearts of mankind in those days?	Yahweh saw that the wickedness of mankind was great, and that their every thought was evil.
6:7	rxil				What did Yahweh decide to do with mankind?	Yahweh decided to wipe away mankind from the earth.
6:8	d4r2				But who found favor with Yahweh?	Noah found favor with Yahweh.
6:9	pikb				What kind of person was Noah?	Noah was a righteous man, blameless, and a man who walked with God.
6:14	peal				What did God tell Noah to do before God destroyed mankind?	God told Noah to build a boat.
6:17	snjr				How did God say he was going to destroy all flesh that has the breath of life in it?	God said that he was going to bring the flood of waters upon the earth.
6:18	m5sz				But with whom did God establish his covenant?	God established his covenant with Noah.
6:18	mzd5				Who did God tell Noah to bring on the boat?	God told Noah to bring his wife, his three sons, and his sons’ wives.
6:19	j3xw				What animals were to be brought on the boat to be kept alive?	Two of every kind of living creature, male and female, were to be brought on the boat.
6:22	xn8m				How did Noah respond to God’s commands?	Noah did all that God commanded him.
7:2	ehjd				Seven males and females of which kinds of animals were to go on the boat?	Seven males and females of every clean animal and the birds were to go on the boat.
7:4	swvf				How long did God say the rain would continue on the earth?	God said that the rain would continue for forty days and forty nights.
7:6	wjts				How old was Noah when the flood came upon the earth?	Noah was six hundred years old when the flood came upon the earth.
7:9	lnzo				How did Noah bring the animals into the boat?	The animals came to Noah and went into the boat.
7:11	ciw1				From which two sources did the waters of the flood come?	The waters came from deep underground, and from the sky.
7:16	q4pg				Once all the people and animals were in the boat, who closed the door?	Yahweh shut the door after them.
7:20	glfx				How high did the water on the earth get?	The water rose fifteen cubits above the tops of the mountains.
7:21	tfgu				Because of the flood, what died upon the earth?	All creatures that moved upon the earth, and all mankind, died.
7:23	o5i7				Who were the only persons left alive on the earth?	Only Noah and those with him in the ark were left alive.
8:1-2	r2uh				How did God make the waters recede?	God made a wind blow, the fountains of the deep were closed, and the rain stopped.
8:4	hsz4				Where did the ark come to rest on the ground?	The ark came to rest upon the mountains of Ararat.
8:9	ixnj				What happened the first time Noah sent out a dove from the ark?	The first time, the dove found no place to rest her foot, and she returned to Noah in the ark.
8:11	zriq				What happened the second time Noah sent out a dove from the ark?	The second time, the dove returned with a freshly plucked olive leaf.
8:12	cbkg				What happened the third time Noah sent out a dove from the ark?	The third time, the dove did not return to Noah.
8:13	i28u				What did Noah see when he removed the covering of the ark and looked out?	Noah saw that the surface of the ground was dry.
8:17	g5bz				What did God want all the creatures on the ark to go and do as they left the ark?	God wanted all the living creatures to be fruitful and multiply on the earth.
8:20	r047				What did Noah do when he left the ark?	Noah built an alter to Yahweh and offering burnt offerings on the altar.
8:21	fws3				What two promises did God make to mankind at this time?	God promised to not again curse the ground, and to not again destroy every living thing.
8:21	dxim				What did God say was man’s inclination from childhood?	God said that man’s inclination from childhood was evil.
9:1	abbb				What did God tell Noah and his sons to do after they left the ark?	God told Noah and his sons to be fruitful, multiply, and fill the earth.
9:3	bi53				What did God give Noah and his sons now as food?	God gave Noah and his sons both the green plants and every moving thing that lived as food.
9:4	ocao				How did God command that meat not be eaten?	God commanded that meat not be eaten with the blood in it.
9:4	hozt				What did God say was in the blood?	God said that the life was in the blood.
9:5-6	yj0e				What did God declare was the penalty for shedding a man’s blood?	God declared that the one who shed a man’s blood must have his blood shed.
9:6	jo8v				In whose image did God make man?	God made man in God’s image.
9:9-11	wg6n				What covenant promise did God make with everything that lives on the earth?	God made a covenant promise that never again will all flesh be destroyed by a flood.
9:13	jy6a				What sign did God give of the covenant that he made with the earth?	God placed the rainbow in the clouds as the sign of the covenant he made with the earth.
9:15	xp9d				What covenant promise did God make with everything that lives on the earth?	God made a covenant promise that never again will all flesh be destroyed by a flood.
9:16-17	uwfh				What sign did God give of the covenant that he made with the earth?	God placed the rainbow in the clouds as the sign of the covenant he made with the earth.
9:18	ipfc				What were the names of the three sons of Noah?	The names of the three sons of Noah were Shem, Ham, and Japheth.
9:20-21	hkzr				What happened to Noah after he planted a vineyard?	After he planted a vineyard, Noah drank some of the wine and became drunk.
9:23	rfv3				How did Shem and Japheth cover the nakedness of their father?	Shem and Japheth walked backwards with a garment, while turned the other way, in order to cover the nakedness of their father.
9:25	fnj4				What was the curse Noah put on Ham?	Noah cursed Ham and said, “Cursed be Canaan. May he be a servant to his brothers’ servants.”
9:26-27	b496				Who did Noah bless?	Noah blessed both Shem and Japheth.
10:5	ml90				After the flood, the descendants of Noah eventually spread out on the earth in clans, and when they spread out, each clan had its own what?	When the clans eventually spread out, each clan had its own language.
10:9	rozw				For what was Nimrod, descendant of Ham, known?	Nimrod was known as a mighty hunter before Yahweh.
10:10	kw0o				What was the first of Nimrod’s primary cities in the land of Shinar?	The first of Nimrod’s primary cities was Babel.
10:11	z1tp				In addition to the land of Shinar, what other area did Nimrod develop with cities?	Nimrod also built cities in Assyria.
10:15	a7am				Canaan was a descendant of which son of Noah?	Canaan was a descendant of Ham.
10:20	cvwn				After the flood, the descendants of Noah eventually spread out on the earth in clans, and when they spread out, each clan had its own what?	When the clans eventually spread out, each clan had its own language.
10:25	vhsh				What happened in the days of Peleg, descendant of Shem?	In the days of Peleg, the earth was divided.
10:31	we9z				After the flood, the descendants of Noah eventually spread out on the earth in clans, and when they spread out, each clan had its own what?	When the clans eventually spread out, each clan had its own language.
10:32	jkuk				From where did the nations come that spread over the earth after the flood?	The nations came from the clans of the sons of Noah.
11:1	xkpv				Immediately after the flood, how many languages were there on the whole earth?	Immediately after the flood, there was one language on the whole earth.
11:2	q8hr				Where did the people build their city and tower?	The people built their city and tower in the land of Shinar.
11:4	hjfb				What did the people decide to do instead of spreading across the whole earth as God had commanded?	Instead of spreading across the whole earth as God had commanded, the people decided to build a city and a tower.
11:4	gzyq				What did the people want to make for themselves?	The people wanted to make a name for themselves.
11:7	q6uw				What did Yahweh come down and do to the people?	Yahweh came down and confused the people’s languages.
11:7	cywp				Why did God do this?	God confused their languages so they would not understand each other.
11:8	fn1t				What did God cause the people then to do?	God caused the people to scatter across the face of all the earth, as he had commanded.
11:9	dys8				What was the name of the city the people tried to build?	The name of the city was Babel.
11:10	aqpf				The descendants of which son of Noah are given in this chapter?	The descendants of Shem, son of Noah, are given in this chapter.
11:26	uv7s				Who was the father of Abram?	The father of Abram was Terah.
11:27	wkut				Terah’s son Haran had a son with what name?	Terah’s son Haran had a son named Lot.
11:28	ija3				Where did Terah live?	Terah lived in Ur of the Chaldeans.
11:29	h1so				What was the name of Abram’s wife?	Abram’s wife’s name was Sarai.
11:30	sspx				What problem did Abram’s wife have?	Abram’s wife’s Sarai was barren and had no children.
11:31	gv0z				To where did Terah move with Abram, Sarai, and Lot?	Terah moved to the land of Canaan with Abram, Sarai, and Lot.
12:1	fw0o				While Abram was living in Haran, what did Yahweh tell Abram to do?	Yahweh told Abram to leave his father’s household and go to the land that he would show Abram.
12:2-3	rzah				What promise did Yahweh make to Abram?	Yahweh promised that he would bless Abram, make him a great nation, and bless all the families of the earth through him.
12:5	p3fo				Who traveled with Abram?	Abram traveled with Sarai, his wife, and Lot, his brother’s son.
12:5	j7hq				To which land did Abram travel?	Abram traveled to the land of Canaan.
12:7	q7z9				When Yahweh appeared to Abram, what promise did he make to Abram?	Yahweh promised that Abram’s descendant’s would live in Canaan.
12:8	fk2r				How did Abram worship Yahweh?	Abram built an altar to Yahweh and called upon Yahweh’s name.
12:10	bthd				Leaving Canaan, to where did Abram travel?	Leaving Canaan, Abram traveled to Egypt.
12:12	bzrj				What was Abram concerned about as he entered Egypt?	Abram was concerned the Egyptians would kill him and take his wife Sarai because she was beautiful.
12:13	yc5j				What did Abram ask Sarai to tell the Egyptians about herself?	Abram asked Sarai to tell the Egyptians that she was Abram’s sister.
12:15	qyg3				What happened to Sarai when they entered Egypt?	Pharaoh took Sarai into his household.
12:17	i46z				What happened to Pharaoh at this time?	Yahweh afflicted Pharaoh and his house with great plagues.
12:18-19	wnyr				What question did Pharaoh ask Abram?	Pharaoh asked Abram why he had told him that Sarai was his sister instead of his wife.
12:20	j8ez				What did Pharaoh do with Abram and Sarai?	Pharaoh sent Abram and Sarai away.
13:1	a4v0				To where did Abram travel after leaving Egypt?	Abram traveled to the Negev.
13:2	i22z				What did Abram carry with him?	Abram carried with him many animals, and much silver and gold.
13:6-7	iavg				Why was there a dispute between Abram’s and Lot’s herdsmen?	There was a dispute because the land could not support Abram and Lot living close together with all their possessions.
13:9	b073				What offer did Abram make to Lot?	Abram offered that Lot choose where to live, and then Abram would find his place to live separated from Lot.
13:10-11	pzu3				Where did Lot choose to live and why?	Lot chose to move east and to live in the plain of the Jordan because it was well watered.
13:12	eo18				Where did Abram then live?	Abram lived in the land of Canaan.
13:13	qze5				What kind of people lived in Sodom?	The people of Sodom were wicked sinners against Yahweh.
13:14-15	nbk5				At this time, what did Yahweh say he would give to Abram?	Yahweh promised that all the land Abram could see from where he was standing would be given to him.
13:16	wq8l				How many descendants did Yahweh say Abram would have?	Yahweh told Abram he would have more descendants than he could count, “abundant as the dust of the earth.”
13:18	towj				Near what city did Abram then move?	Abram moved near the city of Hebron.
14:11-12	dk7v				What happened at Sodom as a result of the battle of the kings in the valley of Siddim?	All the goods of Sodom were taken away, and Lot and all his possessions were also taken.
14:14	xrmp				What did Abram do when he was told Lot had been taken away?	Abram gathered his 318 trained men to pursue them.
14:15-16	s8b4				Near what large city did Abram fight the kings, and what was the result of the battle?	Abram fought the kings north of Damascus, and he brought back the possessions, Lot, and the other people.
14:17-18	fur8				Which two kings met Abram when he returned?	The king of Sodom and Melchizedek, the king of Salem, met Abram when he returned.
14:18	s1z2				What was Melchizedek’s relationship to God?	Melchizedek was priest of God Most High.
14:18	dauj				What did Melchizedek bring with him when he met Abram?	Melchizedek brought bread and wine with him when he met Abram.
14:19-20	jzvw				What did Melchizedek say to Abram?	Melchizedek blessed Abram, and blessed God Most High.
14:20	atk3				What did Abram do after Melchizedek spoke to him?	Abram gave Melchizedek a tenth of everything.
14:21	l928				What offer did the king of Sodom make to Abram?	The king of Sodom offered to let Abram keep all the goods, if Abram gave the people to the king.
14:22-23	ne26				Why did Abram not want any of the possessions?	Abram had lifted up his hand to Yahweh, God Most High, and did not want the king of Sodom to be able to say that he had made Abram rich.
14:23-24	yote				How did Abram respond to the king of Sodom’s offer?	Abram said that he did not want any of the possessions, except what the young men had eaten and the share for the men that went with him.
15:1	xak2				When Yahweh appeared to Abram, what encouragement did Yahweh give Abram?	Yahweh told Abram not to fear, and that he was Abram’s shield and very great reward.
15:2-3	xu28				About what was Abram worried?	Abram was worried because he was still childless, and his steward was his heir.
15:4	a9nn				Who did Yahweh say would be Abram’s heir?	Yahweh said that one coming from Abram’s own body would be his heir.
15:5	l1q5				How many descendants did Yahweh say Abram would have?	Yahweh said that Abram would have descendants as numerous as the stars.
15:6	wx0i				How did Abram respond to Yahweh’s promise, and what did Yahweh then do?	Abram believed Yahweh, and Yahweh counted it to Abram as righteousness.
15:8	pj18				What question did Abram ask Yahweh about the land?	Abram asked Yahweh, “How will I know that I will inherit it”?
15:10	adl6				What did Abram then do with the animals he was told to bring?	Abram cut the animals in two and placed each half opposite the other.
15:12	gvvl				What happened to Abram when the sun was going down?	When the sun was going down Abram fell sound asleep and a deep and terrifying darkness overwhelmed him.
15:13	fka3				For how long did Yahweh say Abram’s descendants would be enslaved and oppressed?	Yahweh told Abram his descendants would be enslaved and oppressed for four hundred years.
15:14	pi1t				What did Yahweh say would happen to the nation that enslaved Abram’s descendants?	Yahweh said that he would judge that nation.
15:15	hdnx				How did Yahweh say Abram’s life would end?	Yahweh said that Abram would die in peace at a good old age.
15:16	et88				What would reach its limit before Abram’s descendants returned to the land promised them?	The sin of the Amorites would reach its limit before Abram’s descendants returned.
15:17	bjel				That night, what happened amongst the pieces of the animals Abram had prepared?	A smoking fire pot and flaming torch passed between the pieces of the animals.
15:18-21	tieq				What covenant did Yahweh make with Abram that day?	Yahweh made a covenant with Abram that he would give this land to Abram’s descendants.
16:1-2	iml0				What idea did Sarai have for giving Abram a descendant?	Sarai told Abram to sleep with her servant, Hagar, in order to have children by her.
16:4	r958				What happened between Hagar and Sarai when Hagar conceived a child with Abram?	After Hagar conceived, Hagar looked with contempt on Sarai.
16:5-6	dl1g				What complaint did Sarai bring to Abram, and how did Abram respond?	Sarai complained that it was Abram’s fault that Hagar despised her, and Abram told Sarai to do what she thought best with Hagar.
16:6	j2m4				How did Sarai treat Hagar after Hagar conceived, and what did Hagar do?	Sarai treated Hagar harshly, and Hagar fled.
16:9	czef				In the wilderness, what did the angel of Yahweh tell Hagar to do?	The angel of Yahweh told Hagar to return to Sarai and submit to her authority.
16:10	xzbk				What promise did the angel of Yahweh make to Hagar?	The angel of Yahweh promised Hagar that her descendants would be too numerous to count.
