Reference	ID	Tags	Quote	Occurrence	Question	Response
16:11	cn12				Why was Hagar told to name her son Ishmael?	Hagar was told to name her son Ishmael because Yahweh had heard her affliction.
16:12	e4oc				How will Ishmael treat other people?	Ishmael will be hostile against every man, and will live apart from all his brothers.
16:13	g4hf				What name did Hagar give Yahweh?	Hagar gave Yahweh the name, “The God who sees me”.
16:16	p9xa				How old was Abram when Ishmael was born?	Abram was eighty-six years old when Ishmael was born.
17:1	ms4u				How old was Abram when Yahweh appeared again to him to confirm his covenant with Abram?	Abram was ninety-nine years old when Yahweh again appeared to Abram.
17:1	yigl				What command did Yahweh give Abram concerning Abram’s way of life?	Yahweh commanded Abram to walk before him blamelessly.
17:5	gjrn				To what did Yahweh change Abram’s name, and what does the name mean?	Yahweh changed Abram’s name to Abraham, which means “father of a multitude of nations”.
17:8	qav0				What did Yahweh give to Abraham’s descendants as part of the covenant?	Yahweh gave Abraham’s descendants all the land of Canaan as part of the covenant.
17:8	de3f				What did Yahweh say would be the relationship between Abraham’s descendants and Yahweh?	Yahweh said that he would be God to Abraham’s descendants.
17:10-11	ind1				What did Yahweh command be done as a sign of the covenant between Abraham and Yahweh?	Yahweh commanded that every male be circumcised as a sign of the covenant between Abraham and Yahweh.
17:12	ivcu				At what age was a baby to be circumcised?	A baby was to be circumcised after eight days.
17:12-13	tb1p				What was to be done with foreigners who joined a household that was in covenant with Yahweh?	Foreigners who joined a household in covenant with Yahweh were also to be circumcised.
17:14	eavn				What happened to any male who was not circumcised?	Any male who was not circumcised was cut off from his people because he had broken the covenant.
17:15	vonf				To what did Yahweh change Sarai’s name?	Yahweh changed Sarai’s name to Sarah.
17:16	blhw				What did Yahweh promise would come by Sarah?	Yahweh promised that Abraham’s son would come by Sarah.
17:17	d2dx				How did Abraham respond to Yahweh’s promise concerning Sarah?	Abraham laughed and asked how a child could be born to a man and woman who were so old.
17:19	bxg4				What did God say Abraham must name the son that would come by Sarah?	God said that Abraham must name the son Isaac.
17:19	ivlk				What did God say he would establish with Isaac?	God said that he would establish his covenant with Isaac.
17:20	xzk2				What promise did God make concerning Ishmael?	God promised to bless Ishmael, to make him fruitful, and to make him a great nation.
17:21	wxhm				What did God say he would establish with Isaac?	God said that he would establish his covenant with Isaac.
17:25	adhc				How old was Ishmael when he was circumcised?	Ishmael was thirteen years old when he was circumcised.
17:24-27	e9is				After God left Abraham, what did Abraham do on that same day?	On that same day, Abraham circumcised all the males of his household.
18:2	pf5i				As Abraham was sitting at his tent door, what did he see when he looked up?	Abraham saw three men standing across from him.
18:4-5	xoiz				What did Abraham offer the men?	Abraham offered the men some water to wash, and some food.
18:9	nu27				Where was Sarah when the visitor gave his prediction?	Sarah was in the tent.
18:10	jm0l				What prediction did the one visitor give concerning Sarah?	The one visitor said that when he returned, Sarah would have a son.
18:12	jyny				How did Sarah respond to the visitor’s prediction?	Sarah laughed to herself when she heard the visitor’s prediction.
18:14	irv5				What did Yahweh, the visitor, say about Sarah’s response?	Yahweh asked why Sarah laughed, and said “Is anything too hard for Yahweh”?
18:16	han0				When the men left Abraham’s home, toward where did they go?	The men left Abraham’s home and went toward Sodom.
18:17	l2o8				What question did Yahweh ask as they walked?	Yahweh said, “Shall I hide from Abraham what I am about to do”?
18:19	l3tc				What did Yahweh say Abraham must do so that Yahweh might fulfill the promises given to Abraham?	Yahweh said that Abraham must instruct his children and his household to do righteousness and justice.
18:20-21	fhd3				Why were the men going toward Sodom?	The men were going toward Sodom because the cries against Sodom and Gomorrah were great, and they wanted to see if the cities were as wicked as the outcry suggested.
18:23	apf3				As Abraham stood with Yahweh, what question did he ask Yahweh?	Abraham asked, “Will you sweep away the righteous with the wicked”?
18:26	fu77				What did Yahweh say he would do if there were fifty righteous within the city?	Yahweh said he would spare the whole place for their sake.
18:28	l4ec				What did Yahweh say he would do if there were forty-five righteous within the city?	Yahweh said he would spare the whole place for their sake.
18:29	gkxs				What did Yahweh say he would do if there were forty righteous within the city?	Yahweh said he would spare the whole place for their sake.
18:30	tqxn				What did Yahweh say he would do if there were thirty righteous within the city?	Yahweh said he would spare the whole place for their sake.
18:31	orsw				What did Yahweh say he would do if there were twenty righteous within the city?	Yahweh said he would spare the whole place for their sake.
18:32	jn7y				What did Yahweh say he would do if there were ten righteous within the city?	Yahweh said he would spare the whole place for their sake.
19:2	inyw				When Lot saw the two angels coming into Sodom, what did he offer them?	Lot offered that they stay at his home for the night, and then leave in the morning.
19:2	jfnq				What was the angels’ response to Lot?	The angels said that they would spend the night in the town square.
19:3	fw6t				At Lot’s urging, where did the angels finally decide to spend the night?	Finally, the angels went with Lot to his home for the night.
19:5	niqs				What did the men of the city who surrounded Lot’s house want Lot to do?	The men wanted Lot to bring out the two men visiting him, so they could sleep with them.
19:8	gx2h				What did Lot offer the men of the city instead?	Lot offered the men of the city his two daughters instead of the two visitors.
19:9	rau9				How did the men respond to Lot’s offer?	The men told Lot to stand back and almost broke down the door.
19:11	fwcs				What did the angels then do?	The angels pulled Lot back into the house and struck the men outside with blindness.
19:13	o9di				What did the angels say they had been sent to do by Yahweh?	The angels said they had been sent to destroy the city.
19:14	txd8				How did Lot’s sons-in-law respond when Lot told them to hurry and leave Sodom because it was about to be destroyed?	Lot’s sons-in-law thought Lot was joking.
19:15	rsnq				When morning dawned, what did the angels tell Lot to do?	The angels told Lot to take his wife and daughters and get out of the city.
19:16	vntr				Why, despite Lot’s lingering, did the angels bring Lot and his family by their hands out of the city?	The angels set them outside the city because Yahweh was merciful to them.
19:17	opfw				What instructions did the angels give Lot when they were outside the city?	The angels told Lot and his family to flee for their lives and to not look back.
19:22	rzcc				Where did the angel allow Lot and his family to flee?	Lot and his family were allowed to flee to a small city called Zoar.
19:24	p3bp				What did Yahweh do when Lot reached Zoar?	Yahweh rained down sulfur and fire from the sky on Sodom and Gomorrah.
19:26	zdlk				What did Lot’s wife do and what happened to her?	Lot’s wife looked back, and she became a pillar of salt.
19:28	naq2				What did Abraham see early in the morning as he looked down at all the land of the plain?	Abraham saw smoke rising from the land like the smoke of a furnace.
19:30	hzlo				To where did Lot then move and why?	Lot then moved to the mountains because he was afraid to live in Zoar.
19:31-32	jgax				What plan did Lot’s daughters make involving their father?	Lot’s daughters planned to make their father drunk, then lie with him so that they could have children.
19:37-38	qbjv				Which two people groups came from the daughters of Lot?	The Moabite and Ammonite people groups came from the daughters of Lot.
20:1-2	pqm9				What did Abraham say about Sarah while he was living at Gerar?	Abraham said that Sarah was his sister.
20:3	p04q				What did God say to Abimelech after he took Sarah?	God came to Abimelech in a dream and told him that he was a dead man because he had taken a man’s wife.
20:5	zdsd				What did Abimelech say to God he had been told by Abraham and Sarah?	Abimelech said to God that Abraham had told him Sarah was his sister, and Sarah had told him Abraham was his brother.
20:7	g6a5				What did God tell Abimelech to do, and what did God say would happen if he did not do it?	God told Abimelech to return Sarah to Abraham; otherwise, he and all his people would die.
20:8	ystk				How did Abimelech’s men respond when they heard what God had told Abimelech?	Abimelech’s men were very afraid when they heard what God had told him.
20:11	mgxy				Why did Abraham say he had told Abimelech that Sarah was his sister?	Abraham said that he was afraid Abimelech would kill him because of Sarah.
20:12	p4jz				In what way was Sarah actually Abraham’s sister?	Sarah was the daughter of Abraham’s father, but not of his mother.
20:16	f12c				What animals and people did Abimelech give Abraham?	Abimelech gave Abraham sheep and oxen, male and female slaves.
20:16	qclv				What reason did Abimelech give Sarah as to why he gave her brother a thousand pieces of silver?	Abimelech told Sarah he had given a thousand pieces of silver to her brother to cover any offense against Sarah in the eyes of all that were with Sarah, and before everyone.
20:17	rrqf				What happened when Abraham prayed to God for Abimelech and his people?	God healed Abimelech, his wife, and his female slaves so they were able to have children.
21:2	jy7v				What did Yahweh do for Sarah?	Yahweh visited Sarah and she bore a son to Abraham at the promised time.
21:4	uqx2				When Isaac was eight days old, what did Abraham do?	When Isaac was eight days old, Abraham circumcised him.
21:6	h7ho				What did Sarah say God had made her do?	Sarah said that God had made her laugh.
21:9	do11				On the day Isaac was weaned, what did Sarah see?	Sarah saw the son of Hagar mocking.
21:10	ql7j				What did Sarah tell Abraham to do with Hagar and her son, and why?	Sarah told Abraham to drive out Hagar and her son, because Hagar’s son would not be heir with Isaac.
21:11	n8pj				What was Abraham’s reaction to Sarah’s demand?	Abraham was grieved by Sarah’s demand.
21:12	h0yy				What did God tell Abraham to do?	God told Abraham to listen to Sarah.
21:14	z3gr				Where did Hagar and her son go after Abraham sent them out?	Hagar and her son went into the wilderness.
21:18	fh7i				What did God tell Hagar he would do for her son?	God said he would make the son of Hagar into a great nation.
21:19	q1lj				How did Hagar and her son survive?	God opened Hagar’s eyes and she saw a well of water.
21:20-21	qqty				What happened to Hagar’s son as he grew up?	Hagar’s son became and archer and his mother got a wife for him from Egypt.
21:23	ihfk				What did Abimelech want Abraham to swear to do for him?	Abimelech wanted Abraham to swear that he would not deal falsely with Abimelech, or with his children, or with his descendants. Abimelech asked Abraham to show to him the same covenant faithfulness that Abimelech had shown to Abraham.
21:25	d0qw				What did Abraham complain about to Abimelech?	Abraham complained to Abimelech about a well of water that Abimelech’s servants had seized from him.
21:28-30	k6vw				Why did Abraham send seven female lambs to Abimelech?	Abraham sent seven female lambs to Abimelech as a witness that he had dug the disputed well.
21:32	gm1l				Into what land did Abimelech return?	Abimelech returned into the land of the Philistines.
21:33	am84				What did Abraham do at the tamarisk tree in Beer-sheba?	Abraham worshiped Yahweh, the eternal God.
21:34	fz51				Where did Abraham live for many days?	Abraham lived in the land of the Philistines for many days.
22:1-2	hi0p				What test did God give Abraham?	God told Abraham to go the land of Moriah and offer Isaac as a burnt offering.
22:3	j6ey				How did Abraham respond to God’s command?	Abraham rose early in the morning and set out on his journey to the place God had told him about.
22:5	ipxe				What did Abraham tell his two young men that he and Isaac were going to do?	Abraham told his two young men that he and Isaac were going to worship and then would return.
22:7	fr0x				What question did Isaac ask Abraham as they were walking together?	Isaac asked Abraham, “Where is the lamb for the burnt offering”?
22:8	aaij				How did Abraham answer Isaac’s question?	Abraham said that God would himself provide the lamb for the burnt offering.
22:9	by1y				When they reached the place, what did Abraham prepare as the burnt offering and how did he do it?	Abraham prepared Isaac as the burnt offering by binding him and laying him on the altar.
22:12	p5je				When Abraham took the knife in his hand, what did the angel of Yahweh tell Abraham?	The angel of Yahweh told Abraham to not harm Isaac.
22:12	w3nh				What did the angel say he now knew about Abraham?	The angel said that he now knew that Abraham feared God.
22:13	fksu				How did God then provide the burnt offering for Abraham?	There was a ram caught in the bushes behind Abraham, which Abraham used as the burnt offering.
22:14	rua9				What did Abraham call the place of the burnt offering?	Abraham called the place, “Yahweh will provide”.
22:16-17	akd1				What reason did the angel of Yahweh give for blessing Abraham?	The angel of Yahweh said he would bless Abraham because Abraham had not withheld his only son.
22:18	qgmk				Through who and why were all nations of the earth to be blessed?	Through Abraham’s offspring all the nations of the earth were to be blessed, because Abraham had obeyed the angel of Yahweh’s voice.
23:2	kyom				What did Abraham first do when Sarah died?	When Sarah died, Abraham first mourned for her and wept for her.
23:3-4	wqck				What request did Abraham make to the sons of Heth?	Abraham asked for a property to use as a burying-place.
23:5-6	sxve				How did the sons of Heth respond to Abraham’s request?	The sons of Heth offered the choicest of their tombs to Abraham.
23:10-11	weev				When Abraham asked for Ephron the Hittite’s cave as a tomb, how did Ephron respond?	Ephron offered to give Abraham the cave and the field next to it.
23:12-13	akx9				How did Abraham respond to Ephron’s offer?	Abraham offered to pay for the field and the cave.
23:14-15	p7ce				How did Ephron respond to Abraham’s offer?	Ephron asked for four hundred shekels of silver for the field and the cave.
23:14-16	z8gw				How did the conversation between Abraham and Ephron end?	Abraham paid four hundred shekels of silver to Ephron for the piece of land.
23:17-18	yw4c				What was included in the purchase of the field of Ephron which was in Machpelah?	The field, the cave that was in it, and all the trees that were in the field and all around its border were included in Abraham’s purchase of the field of Ephron.
23:19	ofps				What did Abraham then do with the cave?	Abraham then buried Sarah in the cave.
24:2-4	edc4				What did Abraham make his oldest servant swear to do?	Abraham made his oldest servant swear that he would get a wife for Isaac from Abraham’s relatives.
24:5-6	ssji				What did Abraham insist that the servant not do with Isaac?	Abraham insisted that the servant not take Isaac back to the land from which Abraham came.
24:12-14	xek3				What did Abraham’s servant ask God to do in order to show him which woman God had chosen for Isaac?	The servant asked that the woman whom he asked to lower her pitcher to get a drink would do so and offer to water his camels also.
24:15	l92f				What relation was Rebekah to Abraham?	Rebekah was the granddaughter of Nahor, Abraham’s brother.
24:17-18	b7t0				What did Rebekah do when Abraham’s servant asked for a drink of water?	Rebekah gave the servant a drink.
24:19	agqs				What did Rebekah say after she had finished giving the servant a drink?	After Rebekah finished giving the servant a drink she said, “I will draw water for your camels also, until they have finished drinking.”
24:26-27	lqht				What did the servant do when he heard that Rebekah was related to Abraham and that he could spend the night with her family?	The servant worshipped Yahweh and blessed him.
24:29	sn9q				Who was Rebekah’s brother?	Laban was Rebekah’s brother.
24:31	f4ed				What did Laban do when he met Abraham’s servant?	Laban invited Abraham’s servant to stay at his house.
24:33	pqk5				What did Abraham’s servant insist on doing before he ate?	Abraham’s servant insisted on saying why he had come before he ate.
24:40	wsjl				How had Abraham said that Yahweh would prosper the servant’s way?	Abraham had said that Yahweh would send his angel with the servant to prosper his way.
24:47	plac				What had the servant given Rebekah when he heard she was related to Abraham?	Abraham’s servant had given Rebekah a gold ring for her nose and bracelets for her arms.
24:50-51	gmne				How did Laban and Bethuel answer Abraham’s servant when he asked them what they wanted to do regarding Rebekah?	Laban and Bethuel answered that the servant should take Rebekah and go, so that Rebekah could be the wife of Abraham’s son.
24:52-53	wx31				What did Abraham’s servant do when he heard the answer from Laban and Bethuel?	The servant bowed down to Yahweh and gave gifts to Rebekah and to her brother and mother.
24:54-55	bnrz				When they arose the next morning, what did Rebekah’s brother and mother want the servant to do?	When they arose the next morning, they wanted Abraham’s servant to stay with them for at least ten more days.
24:56-58	ae7a				When Abraham’s servant said that he wanted to go immediately, what did Rebekah say that she wanted to do?	Rebekah said that she wanted to go with the servant.
24:60	l9dj				What blessing did Rebekah’s family give her as she left with Abraham’s servant?	Rebekah’s family blessed her that she might be the mother of thousands and ten thousands, and that her descendants might possess the gate of those who hate them.
24:63	ki1o				What was Isaac doing when Rebekah arrived at his home?	Isaac was out in the field meditating.
24:64-65	w1a6				What did Rebekah do when she saw Isaac?	When she saw Isaac, Rebekah jumped down from the camel and covered herself with her veil.
24:67	e7qe				What did Isaac do after Abraham’s servant recounted all the things that he had done?	Isaac brought Rebekah into his mother Sarah’s tent and took Rebekah as his wife.
25:1	k74h				What did Abraham do after his wife Sarah died?	Abraham took another wife named Keturah.
25:5-6	y1n2				How did Abraham distribute his wealth?	Abraham gave gifts to the sons of his concubines, and gave all that he owned to Isaac.
25:7	az6r				How many years did Abraham live?	Abraham lived one hundred seventy-five years.
25:9	dowm				Who buried Abraham?	Both Isaac and Ishmael buried Abraham.
25:18	bb0x				How did the twelve sons of Ishmael live with each other?	The twelve sons of Ishmael lived with each other in hostility.
25:21	pi57				What did Isaac do because Rebekah was childless?	Isaac prayed to Yahweh for his wife, and Yahweh answered his prayer, and Rebekah conceived.
25:23	dwc7				What did Yahweh say concerning the two children struggling within Rebekah’s womb?	Yahweh said that there were two nations in her womb, one people stronger than the other, and that the older would serve the younger.
25:25	qywa				Who was born first, and what did he look like?	Esau was born first, and he was red all over like a hairy garment.
25:26	vncw				Who was born second, and what was he doing as he was born?	Jacob was born second, and he was grasping Esau’s heel as he was born.
25:27	hmxp				What kind of man was Esau?	Esau was a skillful hunter and a man of the field.
25:27	uktc				What kind of man was Jacob?	Jacob was a quiet man who spent his time in the tents.
25:28	skvn				Who did Isaac love, and who did Rebekah love?	Isaac loved Esau, and Rebekah loved Jacob.
25:30	w0n8				What was another name for Esau?	Edom was another name for Esau.
25:31	iptb				For what did Jacob ask in return for the red stew that Esau wanted to eat because he was starving?	Jacob asked for Esau’s birthright in return for the red stew.
25:33	gd3l				What was Esau’s response to Jacob’s offer?	Esau swore an oath and sold his birthright to Jacob.
25:34	z8xh				How was Esau treating his birthright when he responded in this way to Jacob’s offer?	Esau was despising his birthright when he responded to Jacob’s offer in this way.
26:1	lueo				Why did Isaac move to the city of Gerar where Abimelech was the king of the Philistines?	Isaac moved to Gerar because there was a famine in the land.
26:2	w1y3				What had Yahweh told Isaac before Isaac moved to Gerar?	Yahweh had told Isaac not to move to Egypt, and to stay in the land about which he would tell Isaac.
26:3	k3jx				What did Yahweh tell Isaac about the oath Yahweh had sworn to his father Abraham?	Yahweh told Isaac that he would fulfill the oath which Yahweh had sworn to Abraham.
26:5	civ6				Why did Yahweh say he was going to do this?	Yahweh said he was going to do this because Abraham had obeyed his voice and kept his instructions, commandments, statutes, and laws.
26:7	gepm				What did Isaac say to the men of Gerar about Rebekah, his wife?	Isaac told the men of Gerar that Rebekah was his sister.
26:9-10	ifp8				According to Abimelech, what could have brought guilt upon the people because of Isaac’s lie?	Because of Isaac’s lie, someone could have had sexual relations with Rebekah and brought guilt upon the people.
26:11	z7qo				What command did Abimelech give regarding Rebekah?	Abimelech commanded that anyone who touched Rebekah would be put to death.
26:16	qn1j				What reason did Abimelech give for asking Isaac to move away from the Philistines?	Abimelech asked Isaac to move away from the Philistines because he said, “…for you are mightier than we.”
26:18	radb				Why did Isaac have to dig out the wells of water which they had dug in the days of Abraham?	Isaac had to dig out the wells of water which they had dug in the days of Abraham because the Philistines had stopped them up after Abraham’s death.
26:22	pih6				What did Isaac name the well over which the herdsmen of Gerar did not quarrel with him?	Isaac named the well, over which the herdsmen of Gerar did not quarrel with him, Rehoboth.
26:23-24	nluw				What did Yahweh reaffirm to Isaac when he appeared to Isaac at Beersheba?	Yahweh reaffirmed that he would bless Isaac and multiply his descendants.
26:28-29	q1rv				What covenant did Abimelech want to make with Isaac, and why?	Abimelech wanted to make a covenant that neither side would harm the other, because he saw that Yahweh was with Isaac.
26:30-31	llyy				How did Isaac respond to Abimelech’s request for a covenant between them?	Isaac made a feast, and they swore an oath with each other.
26:34	tzp8				From what people group were the two wives of Esau?	The two wives of Esau were from the Hittites.
26:35	t9zt				How was the relationship between Esau’s wives and Isaac and Rebekah?	Esau’s wives brought sorrow to Isaac and Rebekah.
27:1	lsu5				As Isaac grew old, what was he no longer able to do?	As Isaac grew old, he was no longer able to see.
27:3-4	ht45				What did Isaac ask Esau to do, and why?	Isaac asked Esau to go hunt and make the sort of food that he loved, so that he could eat it and bless Esau.
27:8-10	cx7m				What was Rebekah’s plan for providing the food for Isaac, and why?	Rebekah told Jacob to go get two goats and she would make the food that Isaac loved, so that Jacob could take it to Isaac and receive the blessing.
27:11-12	b563				About what was Jacob concerned in bringing the food to Isaac?	Jacob was concerned that Esau was a hairy man and he was a smooth man, and that Isaac would touch him and find out that Jacob was a deceiver and curse him.
27:15-16	ovvp				How did Rebekah solve the problem of Esau being a hairy man, and Jacob a smooth man?	Rebekah put Esau’s clothes on Jacob and put goatskins upon his hands and neck.
27:20	p4xi				When Isaac asked, how did Jacob say he had found the game so quickly?	Jacob said that Yahweh, Isaac’s God, had brought the game to him.
27:22-23	bzju				Because he was not sure, how did Isaac try to determine who was giving him the food?	Isaac touched Jacob on the hands and felt the hairy goatskins.
27:24	xcur				What did Jacob say when Isaac asked, “Are you really my son Esau”?	Jacob said, “I am”.
27:26-27	j8y6				What finally convinced Isaac that the person bringing the food was Esau?	When Jacob came near Isaac to kiss him, Isaac smelled Esau’s clothes.
27:29	t0m5				Who did Isaac say would bow down to Jacob?	Isaac said nations would bow down to Jacob and that Jacob’s mother’s sons would bow down to him.
27:30-31	wrna				What did Esau do soon after Jacob left Isaac’s tent?	Esau came in from hunting, prepared the food, and brought it to Isaac.
27:34-35	s6bp				What did Isaac say when Esau asked for Isaac’s blessing?	Isaac said that Jacob had deceitfully taken away Esau’s blessing.
27:36	dvnz				In what two ways did Esau say Jacob had cheated him?	Esau said that Jacob had cheated him from his birthright and from his blessing.
