Reference	ID	Tags	Quote	Occurrence	Question	Response
27:39-40	cr1a				What was the “blessing” that Isaac gave Esau?	Isaac said that Esau would live away from the fatness of the earth, that he would serve his brother, but would eventually rebel against him and shake off Jacob’s yoke.
27:41	aijf				What did Esau decide to do after Isaac’s death?	Esau decided to kill Jacob after Isaac’s death.
27:43	zwoz				What did Rebekah do after hearing Esau’s plans?	Rebekah sent Jacob to Laban, her brother, in Haran.
28:1	n272				What command did Isaac give Jacob before he left?	Isaac commanded Jacob not to take a Canaanite wife.
28:2	cz76				Where did Isaac tell Jacob to get a wife?	Isaac told Jacob to get a wife from the daughters of Laban, Rebekah’s brother.
28:4	ypne				Whose blessing did Isaac ask God to give Jacob?	Isaac asked God to give Jacob the blessing of Abraham.
28:8-9	f1it				From where did Esau get one of his wives when he saw that the women of Canaan did not please Isaac?	Esau took a wife from the daughters of Ishmael, Abraham’s son.
28:12-13	uuyp				What did Jacob see in his dream while on the way to Haran?	Jacob saw a ladder from earth to heaven with angels ascending and descending on it, and Yahweh standing above it.
28:13	ckcc				What did Yahweh say about the land Jacob was lying on?	Yahweh said that the land Jacob was lying on would be given to him and his descendants.
28:13	gb0s				Whose blessing did Yahweh give to Jacob?	Yahweh gave Jacob the blessing of Abraham.
28:17	jv7q				What did Jacob say about the place where he had the dream?	Jacob said the place was the house of God and the gate of heaven.
28:19	a57e				What name did Jacob give the place where he had the dream?	Jacob named the place Beth-el.
28:20-21	bluq				What did Jacob say Yahweh must do in order for Yahweh to be his God?	Jacob said that Yahweh must be with him and protect him on his journey so that he returned safely to his father’s house.
28:22	vgyt				What did Jacob promise to give Yahweh if Yahweh did these things for him?	Jacob promised to give back to Yahweh a tenth of everything Yahweh gave Jacob.
29:4	zudl				From where were the men that Jacob talked to?	The men were from Haran.
29:6	avg8				Who also came to the well with a flock of sheep?	Rachel, daughter of Laban, also came to the well with a flock of sheep.
29:10	vg71				What did Jacob do for Laban’s sheep?	Jacob rolled the stone from the well’s mouth and watered the sheep.
29:12	rs90				What did Jacob tell Rachel, and then what did she do?	Jacob told Rachel that he was her father’s relative, and then Rachel ran and told her father.
29:13	jjwh				How did Laban react when he heard about Jacob’s arrival?	Laban ran to meet Jacob, embraced him, kissed him, and brought him to his house.
29:16-17	d50e				Describe the two daughters of Laban.	Leah was the older daughter and she had tender eyes, while Rachel was the younger and was beautiful in form and appearance.
29:18	cfi2				What arrangement did Laban and Jacob make concerning Jacob’s labor?	They agreed that Jacob would serve Laban seven years in return for Rachel.
29:20	gevv				Why did the seven years of labor only seem like a few days to Jacob?	The seven years of labor seemed only like a few days because of the love Jacob had for Rachel.
29:24	yi20				Who did Laban give to Leah, to be her servant?	Laban gave his female servant Zilpah to his daughter Leah, to be her servant.
29:23-25	jzl8				How did Laban trick Jacob?	Laban gave Leah to Jacob, instead of Rachel, the night of the wedding.
29:26	f1wr				Why did Laban say he had tricked Jacob?	Laban said it was not their custom to give the younger daughter in marriage before the first-born.
29:27	dpby				What arrangement did Laban and Jacob then make concerning Jacob’s labor?	They agreed that Jacob would serve Laban seven more years in return for Rachel.
29:29	qz1r				Who did Laban give to Rachel, to be her servant?	Laban gave Bilhah to his daughter Rachel, to be her servant.
29:31	h3e2				What did Yahweh do when he saw that Jacob did not love Leah?	Yahweh caused Leah to become pregnant, but Rachel was childless.
29:32	zft4				What did Leah hope would happen if she bore sons for Jacob?	Leah hoped that Jacob would love her if she bore sons for him.
29:32	zq0n				What was the name of Leah’s first son?	The name of Leah’s first son was Reuben.
29:35	xibh				What did Leah say after she bore Judah?	After she bore Judah Leah said, “This time I will praise Yahweh.”
30:2	iytc				According to Jacob, why did Rachel have no children?	According to Jacob, God had kept Rachel from having children.
30:3	cc3l				What did Rachel do in order to have children?	Rachel gave Jacob Bilhah her servant so she could have children on Rachel’s behalf.
30:7-8	sies				Why did Rachel say that she had prevailed against her sister Leah?	Rachel said that she had prevailed because Bilhah her servant bore two sons for Jacob.
30:9	o7mp				What did Leah do when she saw that she had stopped bearing children?	Leah gave Jacob Zilpah her servant so she could have children on Leah’s behalf.
30:10-11	u35v				What caused Leah to say, “This is fortunate.”?	Leah said, “This is fortunate.” because Zilpah her servant bore Jacob a son.
30:14-15	mkyh				What did Rachel offer Leah in exchange for her son’s mandrakes?	In exchange for Reuben’s mandrakes, Rachel offered to let Leah sleep with Jacob that night
30:20	og8t				How many sons did Leah bear for Jacob?	Leah bore six sons for Jacob.
30:23	zmua				What caused Rachel to say that her shame had been taken away?	When Rachel bore a son for Jacob, she said that her shame had been taken away.
30:25-26	hgey				What request did Jacob make to Laban after Joseph was born?	Jacob requested that Laban let Jacob go with his family back to his own home and country.
30:27	r8fx				Why did Laban not want to let Jacob go away?	Laban had divined that Yahweh had blessed him for Jacob’s sake.
30:32	evbq				What wages did Jacob receive for his work for Laban?	Jacob took the speckled, spotted, and black sheep, and the speckled and spotted goats from Laban’s flock that he tended.
30:35-36	b92l				How did Laban cheat Jacob concerning Jacob’s wages?	Laban first removed the animals that Jacob would have taken, before he gave the flock to Jacob to tend.
30:37	eoe2				What kind of sticks did Jacob peel white streaks into?	Jacob peeled white streaks into branches of fresh poplar, almond, and plane trees.
30:38	jo1b				What did Jacob do with the peeled sticks?	Jacob put the sticks that he had peeled in front of the flocks, in front of the watering troughs where they came to drink.
30:39	spaf				What happened when the flocks bred in front of the sticks?	When the flocks bred in front of the sticks they produced striped, speckled, and spotted young.
30:42	nvvp				What was the result of Jacob’s breeding of the animals?	The result was that Laban’s flock was feebler, and Jacob’s flock was stronger.
31:1-2	acjl				From where did Laban and his sons believe Jacob had gotten all his wealth?	Laban and his sons believed that Jacob had gotten all his wealth from Laban’s possessions.
31:3	l1et				What instructions did Yahweh give Jacob?	Yahweh instructed Jacob to return to the land of his fathers and to his relatives.
31:8-9	c488				How had God taken away the cattle of Laban and given them to Jacob?	God had caused the animals to bear speckled, and striped young which were Jacob’s wages.
31:14-15	gkk5				What attitude did Rachel and Leah have toward their father Laban?	Rachel and Leah said that Laban treated them as foreigners and had devoured their money.
31:19	eas5				What did Rachel do before leaving with Jacob?	Rachel stole her father’s household gods.
31:20	vqc6				How did Jacob deceive Laban at this time?	Jacob deceived Laban by not telling Laban that he was leaving.
31:22-23	o6yd				What did Laban do when he was told that Jacob had fled?	Laban took his relatives with him and pursued Jacob, overtaking him after seven days.
31:24	vm4s				What did God tell Laban in a dream?	God told Laban to speak neither good or bad to Jacob.
31:31	zh3p				Why did Jacob say that he had fled from Laban secretly?	Jacob said that he fled secretly because he was afraid that Laban would take his daughters from him by force.
31:32	ods8				What did Jacob say when Laban accused him of stealing his household gods?	Jacob said that whoever stole Laban’s household gods would not continue to live.
31:34-35	r1hz				Why did Laban not find his household gods among Jacob’s possessions?	Laban did not find his household gods because Rachel sat on them and then said that she could not stand up since she was having her period.
31:41	wvq8				How long had Jacob worked for Laban, and how many times had Laban changed his wages?	Jacob had worked for Laban twenty years, and Laban had changed his wages ten times.
31:43	h9sd				How did Laban show that he still thought of Jacob’s possessions as his own?	Laban said that all that he saw of Jacob’s possessions was his.
31:46	ujjd				How did Jacob and Laban mark the place of their covenant?	Jacob and Laban marked the place of their covenant by making a pile of stones there.
31:49-50	sfxa				Who was declared as witness between Jacob and Laban to ensure the covenant would be kept?	God was declared as witness between Jacob and Laban to ensure the covenant would be kept.
31:51-52	fh8f				What were the pile and the pillar for?	The pile and pillar were both witnesses to the covenant which said neither Laban nor Jacob would pass the pile or pillar to do one another harm.
31:52	hvrv				What covenant did Jacob and Laban make?	Jacob and Laban each agreed to not pass beyond the pile of stones to do the other harm.
31:53	d52u				What did Jacob do to show that he agreed to the covenant?	To show that he agreed with Laban about the covenant Jacob swore by God, who his father Isaac feared.
31:55	pga5				What did Laban do the next morning?	Laban rose, kissed his grandsons and daughters, blessed them, and returned home.
32:3	he3t				To whom did Jacob send a message on his way toward Canaan?	Jacob sent a message to his brother Esau on his way toward Canaan.
32:5	dh86				For what purpose did Jacob send this message?	Jacob desired to find favor in Esau’s sight.
32:7-8	x3zd				What was Jacob’s reaction when he heard Esau was coming with four hundred men, and what did he do?	Jacob was afraid, so he divided his people into two groups so that if Esau attacked one group, the other could escape.
32:11	hrla				What was Jacob’s request to Yahweh?	Jacob asked Yahweh to deliver him from the hand of Esau.
32:12	tw3p				Of what promise did Jacob remind Yahweh?	Jacob reminded Yahweh that he had promised to prosper Jacob, and to make is descendants like the sand of the sea.
32:20	vhy7				What did Jacob think he could accomplish by sending gifts to his brother Esau?	Jacob thought that perhaps he could appease Esau with the gifts that he sent to Esau so that later, when Jacob saw him, Esau would receive him.
32:22	cmkc				How did Jacob end up being alone that night?	He took his wives, servant women, and children across the ford of the Jabbok.
32:24	cltr				What did Jacob do that night until daybreak?	Jacob wrestled with a man until daybreak.
32:25	ql1p				What did the man do when he could not defeat Jacob?	The man struck Jacob’s hip and dislocated it.
32:26	nc65				What did Jacob demand before he would let the man go?	Jacob demanded that the man bless him.
32:28	xgjo				What did the man say Jacob would there after be called?	The man said that Jacob’s name would now be Israel.
32:30	e5du				Who did Jacob say he had seen face to face that night?	Jacob said he had seen God face to face that night.
32:32	f51x				What physical problem did Jacob continue to have after that night?	Jacob limped because of his hip after that night.
33:2-3	v4sl				As Esau was coming to Jacob, in what order did Jacob put his wives behind him?	Jacob put his female servants first, then Leah, and then Rachel.
33:3	lq1c				What did Jacob do as he came near his brother?	Jacob bowed toward the ground seven times as he came near his brother.
33:4	njyl				What did Esau do when he came to his brother?	Esau ran to meet Jacob, embraced him, hugged his neck, and kissed him.
33:9	t837				What did Esau tell Jacob to do with the gifts he had sent ahead to Esau?	Esau told Jacob to keep them for himself, since he had enough.
33:11	w17d				What two reasons did Jacob give Esau to accept his gifts?	Jacob said that because God had dealt graciously with him, and because he had enough, Esau should accept his gifts.
33:12-14	c24e				Why did Jacob say he wanted Esau to go ahead, while he traveled more slowly?	Jacob said he wanted Esau to go ahead because the flocks would die if they were driven too fast.
33:14	c0v1				Where did Jacob say he was going to bring his family and his flocks?	Jacob said he was going to bring his family and flocks to Esau in Seir.
33:17	lx68				To where did Jacob travel, where he built himself a house?	Jacob traveled to Succoth, where he built himself a house.
33:18-19	psti				To where did Jacob travel, where he bought a piece of ground?	Jacob traveled to Shechem, where he bought a piece of ground.
34:2	e3el				What did Shechem, the son of Hamor, do when he saw Dinah, Leah’s daughter?	Shechem grabbed Dinah, assaulted her, and forced himself on her.
34:5	k1dq				What did Jacob do at first when he heard about what happened to Dinah?	Jacob held his peace until his sons came in from the field.
34:7	hk7w				What was the reaction of Jacob’s sons when they heard what Shechem had done to Dinah?	Jacob’s sons were very angry.
34:8-9	q2ru				What did Hamor, the father of Shechem, want Jacob to do?	Hamor wanted Jacob to give Dinah to Shechem as his wife, and to allow Jacob’s family to intermarry with Hamor’s family.
34:12	uo8j				What did Shechem say he was willing to do to have Dinah as his wife?	Shechem said he would pay as great a bride price as Jacob would name.
34:13	jhwz				In what way did the sons of Jacob answer Shechem, and why?	The sons of Jacob answered Shechem deceitfully, because Shechem had defiled Dinah.
34:15	rgpt				What requirement did the sons of Jacob make to Hamor before they would agree to intermarry with Hamor’s family?	The sons of Jacob required that all the males in Hamor’s family be circumcised.
34:23	gn7o				When speaking to the men of their city, what did Hamor and Shechem say would be theirs if they intermarried with Jacob’s family?	They said that all of Jacob’s livestock, property, and animals would be theirs if they intermarried with Jacob’s family.
34:24	tonw				How did the men of Hamor’s city respond when asked if they were willing to be circumcised?	The men of Hamor’s city listened to Hamor and Shechem and every male was circumcised.
34:25	lini				What did Simeon and Levi do on the third day after the males from Hamor’s family had been circumcised?	Simeon and Levi killed all the males in Hamor’s city.
34:27-29	etr5				What then did all of the sons of Jacob do?	All of the sons of Jacob looted the city, took all the wealth, and captured the children and wives.
34:30	g1aw				How did Jacob respond when he learned about what Simeon and Levi had done?	Jacob said that Simeon and Levi had brought trouble on him because the inhabitants of the land might now destroy him and his household.
34:31	b3e6				Why did Simeon and Levi say they had done it?	Simeon and Levi said they had done it because Shechem had treated their sister Dinah like a prostitute.
35:1	y25x				What did God tell Jacob to go and do?	God told Jacob to go to Bethel and to build an altar to God.
35:2	tduy				What did Jacob then tell the people of his household to do?	Jacob told them to put away their foreign gods, to purify themselves, and to change their clothes.
35:5	pc9n				As they traveled, why did the people of the cities around Jacob and his household not pursue them?	The people of the cities around them did not pursue them because they were afraid of God.
35:7	gyqh				Why did Jacob call the place they came to “Elbethel”?	Jacob called it “Elbethel” because it was the place God had revealed himself to Jacob when Jacob was fleeing from Esau.
35:10	wmj7				What new name did God give Jacob?	God gave Jacob the new name Israel.
35:12	qjtu				What promise did God reaffirm to Jacob?	God reaffirmed the promise that Jacob would become a company of nations with kings among his descendants, and that the land God had promised to Abraham and Isaac would be given to him and his descendants.
35:18-19	kb9l				What happened to Rachel during her labor with Benjamin?	Rachel died during her labor with Benjamin.
35:22	n3p4				Israel heard about what thing that Reuben had done?	Israel heard that Reuben had slept with Bilhah, Israel’s concubine.
35:22	qc1o				How many sons did Jacob have?	Jacob had twelve sons.
35:24	qtvj				Which sons of Jacob were born from Rachel?	Joseph and Benjamin were born from Rachel.
35:28	fl7e				How many years did Isaac live?	Isaac lived one hundred eighty years.
35:29	zoep				Who buried Isaac?	Esau and Jacob buried Isaac.
36:1	ayah				By what other name are the descendants of Esau called?	The descendants of Esau are also called Edom.
36:2	okxi				From where did Esau get his wives?	Esau took his wives from the Canaanites.
36:6-7	u0hn				Why did Esau move away from his brother Jacob?	Esau moved away from his brother Jacob because the land could not support both of them as their possessions were too many.
36:8	nc8g				Where did Esau settle?	Esau settled in the hill country of Seir.
36:12	yzmh				What was the name of the son born by Timna, a concubine of Esau’s firstborn son Eliphaz?	The name of the son born by Timna was Amalek.
36:15-16	gzn0				What was the name of the son born by Timna, a concubine of Esau’s firstborn son Eliphaz?	The name of the son born by Timna was Amalek.
36:20	dabb				Who was the father of the inhabitants of the land in which Edom lived?	Seir the Horite was the father of the inhabitants of the land in which Edom lived.
36:31	cgun				What did the people of Edom have before Israel had them?	The people of Edom had kings before any king reigned over the Israelites.
36:43	itg1				Who was the father of the Edomites?	Esau was the father of the Edomites.
37:1	fko7				Where did Jacob settle to live?	Jacob lived in the land of Canaan.
37:2	ezrp				What did Joseph bring to his father Jacob while guarding the flock with his brothers?	Joseph brought to his father an unfavorable report about his brothers.
37:3	jbk5				How did Israel show that he loved Joseph more than his other sons?	Israel made Joseph a luxurious tunic.
37:4	hvyv				What did Joseph’s brothers think about Joseph?	Joseph’s brothers hated him and would not speak to him cordially.
37:7	wbcv				What did Joseph see in his first dream?	Joseph saw his sheaf stand upright while his brothers’ sheaves bowed down to his sheaf.
37:8	vzfg				What did Joseph’s brothers think about Joseph after he told them about his first dream?	Joseph’s brothers hated him even more.
37:9	ipqs				What did Joseph see in his second dream?	Joseph saw the sun, moon, and eleven stars bow down to him.
37:10	alk8				In Joseph’s second dream, what did the sun, moon, and stars represent?	The sun, moon, and stars represented Joseph’s father, mother, and brothers.
37:14	iajm				What did Jacob send Joseph out of the valley of Hebron to do?	Jacob sent Joseph out of the valley of Hebron to see if it was well with his brothers, and to bring Jacob word.
37:20	nr70				What did Joseph’s brothers plan to do when they saw Joseph coming?	Joseph’s brothers planned to kill Joseph and cast him into one of the pits.
37:22	h9i2				What suggestion did Reuben make to his brothers, and why?	Reuben suggested that the brothers only throw Joseph into a pit, so that he could rescue Joseph later.
37:28	c7x3				Who did Joseph’s brothers sell Joseph to and for how much?	Joseph’s brothers sold Joseph to the Ishmaelites for twenty pieces of silver.
37:28	qcam				To where was Joseph taken?	Joseph was taken to Egypt.
37:31-32	vj4d				How did Joseph’s brothers make it appear that Joseph was dead?	Joseph’s brothers killed a goat and dipped Joseph’s coat in the blood, then gave the coat to Jacob.
37:34	jq3z				What did Jacob do after he concluded Joseph was dead?	Jacob tore his garments, wore sackcloth, and mourned his son for many days.
37:36	tgkm				To whom was Joseph sold in Egypt?	Joseph was sold to Potiphar, an officer of Pharaoh, in Egypt.
38:2	cgzi				From whom did Judah take a wife?	Judah took a wife from a Canaanite man.
38:7	c2w4				What did Yahweh do with Judah’s first son Er, and why?	Yahweh killed Er because he was wicked.
38:9	atvf				How did Judah’s second son Onan not fulfill the duty of a brother-in-law to raise up a child for Er?	Onan would spill his semen on the ground when he made love to Tamar.
38:10	vuey				What did Yahweh do with Judah’s second son Onan, and why?	Yahweh killed Onan because what he did was evil.
38:11	onsk				What promise did Judah then make to Tamar?	Judah promised Tamar his third son Shelah as a husband when Shelah grew up.
38:12	pe6s				After a long time, why did Judah need to be comforted?	Judah was comforted because his wife died.
38:14	a2yb				What did Tamar do when she heard that Judah was going to Timnah?	Tamar took off her clothing of widowhood, put on a veil and wrapped herself, and sat by the road to Timnah.
38:14	phdq				Why did Tamar do this?	Tamar did this because Judah’s third son Shelah had grown up, but she had not been given to him as a wife.
38:18	hntk				What did Tamar obtain as a pledge for payment before Judah made love to her?	Judah gave Tamar his seal, cord, and staff as a pledge of payment.
38:21	m6ua				When Judah tried to retrieve his pledge by paying the prostitute with a young goat, what did he learn?	Judah learned that there was no temple prostitute in that area.
38:24	thzq				What did Judah want to do when he learned that Tamar was pregnant?	Judah wanted to burn Tamar because she had become pregnant as a prostitute.
38:25	w071				What did Tamar do when she was brought out to Judah?	She said that she was pregnant by the man who owned the seal, cord, and staff she had.
38:26	n7d1				How did Judah respond when he saw his seal, cord, and staff?	Judah said that Tamar was more right than he was, because he had not given Tamar to Shelah as a wife.
38:27	revs				How many children did Tamar bear?	Tamar had twin sons.
38:28	l9k9				What did the midwife do when one of Tamar’s twins put his hand out from Tamar’s womb?	When one of Tamar’s twins put his hand out from Tamar’s womb The midwife took a scarlet thread and tied it on his hand and said, “This one came out first.”
38:29-30	ai7z				What were the names of the two brothers that Tamar birthed?	The names of the two brothers that Tamar birthed were Perez and Zerah.
39:1	e79r				Who bought Joseph in Egypt?	Potiphar, an official of Pharaoh, bought Joseph in Egypt.
39:3-4	yxtv				Why was Joseph prosperous in Egypt?	Joseph was prosperous because Yahweh was with him.
39:6	ssky				What did Potiphar put under Joseph’s care?	Potiphar put everything he had under Joseph’s care.
39:7	ofip				What did Potiphar’s wife ask Joseph to do?	Potiphar’s wife asked Joseph to make love to her.
39:8-9	abzl				How did Joseph respond to Potiphar’s wife’s request?	Joseph refused and said he could not commit this great wickedness and sin against God.
39:12	le7t				What did Joseph do when Potiphar’s wife caught him by his clothes?	Joseph left his clothing in her hand and fled outside.
39:14-15	xxx9				What accusation did Potiphar’s wife make against Joseph?	She accused him of trying to make love to her against her will.
39:19-20	zd50				What did Potiphar do when he heard the accusation against Joseph?	Potiphar became very angry and put Joseph in prison.
39:21	fsk3				At this time, what did Yahweh show to Joseph?	Yahweh showed covenant faithfulness to Joseph at this time.
39:22	j5od				What did the prison warden put under Joseph’s care?	The prison warden put all the prisoners under Joseph’s care.
39:23	bfzm				What was the result of everything Joseph did, and why?	Everything Joseph did, Yahweh prospered.
40:1	r85x				Why did the king of Egypt put his cupbearer and his baker in prison?	He put them in prison because they offended him.
40:5	f0iq				What happened to the cupbearer and the baker on the same night?	The cupbearer and the baker each dreamed a dream the same night.
40:7-8	xi48				Why were the cupbearer and baker both sad the next morning?	They were both sad because no one could interpret their dreams.
40:8	t89o				Who did Joseph say could give the interpretation of the dreams?	Joseph said that God could give the interpretation of the dreams.
40:12-13	c25c				What did Joseph say was the interpretation of the cupbearer’s dream?	Joseph said that the dream meant that within three days Pharaoh would restore the cupbearer to his office.
40:14	hhco				What request did Joseph make to the cupbearer after giving the interpretation of his dream?	Joseph requested that the cupbearer remember him, mention him to Pharaoh, and bring him out of the prison.
40:18-19	h2dk				What did Joseph say was the interpretation of the baker’s dream?	Joseph said that the dream meant that within three days Pharoah would hang the baker on a tree.
40:20	vwig				What special event occurred three days later?	Pharaoh’s birthday was three days later.
40:21-22	d3yv				What did Pharaoh do with the cupbearer and the baker on that day?	Pharaoh restored the cupbearer, but he hanged the baker, just as Joseph had interpreted to them.
40:23	e74z				Did the cupbearer remember Joseph’s request to him?	No, the cupbearer did not remember to help Joseph, but forgot about him.
