Reference	ID	Tags	Quote	Occurrence	Question	Response
11:23-24	qhjm				What can God do with natural branches if they do not continue in their unbelief?	God can graft back into the olive tree natural branches that do not continue in their unbelief.
11:25	e0td				How long will the partial hardening of Israel last?	The partial hardening of Israel will last until the completion of the Gentiles comes in.
11:28-29	k79i				Despite their disobedience, why do the Israelites continue to be loved by God?	The Israelites continue to be loved by God because of the ancestors and because the call of God is unchangeable.
11:30-32	borw				What have both Jew and Gentile been shown to be by God?	Both Jew and Gentile have been shown to be disobedient.
11:30-32	rwzh				What has God shown to the disobedient?	God has shown mercy to the disobedient, both Jew and Gentile.
11:33-34	hdrd				Who is able to search God’s judgments and give him advice?	No person can search God’s judgments and give him advice.
11:36	ae8v				What are the three ways all things are related to God?	All things are from God, through God, and to God.
12:1	o7ka				What is the spiritual service to God for a believer?	A believer’s spiritual service is to present himself a living sacrifice to God.
12:2	b26e				What does a transformed mind in the believer enable him to do?	A transformed mind enables a believer to know what is the good, acceptable, and perfect will of God.
12:3	bp7w				How should a believer not think of himself?	A believer should not think of himself more highly than he ought to think.
12:4-5	wb8y				How are the many believers related to each other in Christ?	The many believers are one body in Christ, and individually members of each other.
12:6	zijb				What should each believer do with the gifts God has given him?	Each believer should exercise his gifts according to the proportion of his faith.
12:10	c79o				How should believers treat one another?	Believers should be affectionate to one another and respect one another.
12:13	mzc3				How should believers respond to the needs of the saints?	Believers should share in the needs of the saints.
12:14	pscz				How should believers respond to those who persecute them?	Believers should bless, and not curse, those who persecute them.
12:16	anqw				How should believers treat lowly people?	Believers should accept lowly people.
12:18	owv2				As much as is possible, what should believers seek with all people?	As much as is possible, believers should seek peace with all people.
12:19	xnnx				Why should believers not avenge themselves?	Believers should not avenge themselves, because vengeance belongs to the Lord.
12:21	g7d6				How should believers overcome evil?	Believers should overcome evil with good.
13:1	xrby				From where do earthly authorities get their authority?	Earthly authorities are appointed by God and get their authority from God.
13:2	sx7k				What will those receive who oppose the earthly authority?	Those who oppose the earthly authority will receive judgment upon themselves.
13:3	y0c9				What does Paul tell believers to do so that they can be unafraid of the ruling authority?	Paul tells believers to do what is good so that they can be unafraid of the ruling authority.
13:4	irf7				What authority has God given rulers in order to suppress evil?	God has given rulers the authority to carry the sword and to punish the one who does evil.
13:6	mdws				What authority has God given rulers regarding money?	God has given rulers the authority to require payment of taxes.
13:8	w0cl				What is the one thing Paul says believers should owe to others?	Paul says that believers should owe love to others.
13:8	tkuz				How does a believer fulfill the law?	A believer fulfills the law by loving his neighbor.
13:9	d1f1				Which commandments does Paul list as part of the law?	Paul lists the commandments to not commit adultery, not kill, not steal, and not covet as part of the law.
13:10	o6kw				How does a believer fulfill the law?	A believer fulfills the law by loving his neighbor.
13:12	d02c				What does Paul say believers should put aside, and put on?	Paul says believers should put aside the works of darkness and put on the armor of light.
13:13	zglc				In what activities are believers not to walk?	Believers are not to walk in wild celebrations, drunkenness, sexual immorality, uncontrolled lust, strife, or jealousy.
13:14	jj48				What should be the believer’s attitude toward the lusts of the flesh?	The believer should make no provision for the lusts of the flesh.
14:2	qeis				What kind of food does a person with stronger faith eat, and what does a person with weaker faith eat?	A person who is stronger in faith eats anything, but a person who is weaker in faith eats only vegetables.
14:3	bnrl				What attitude should believers who differ on what they eat have toward one another?	Believers who differ on what they eat should not despise or judge each other.
14:3-4	vy2n				Who has received both the one who eats anything and the one who eats only vegetables?	God has received both the one who eats anything and the one who eats only vegetables.
14:5	qv1y				What other issue does Paul mention as being an issue of personal conviction?	Paul mentions as an issue of personal conviction whether one day is valued over another or all days are valued equally.
14:7-8	k86y				For what do believers live and die?	Believers live and die for the Lord.
14:10	hg2o				Where will all believers ultimately stand?	All believers will ultimately stand before the judgment seat of God.
14:13	jj8b				What attitude should a brother have toward another brother on issues of personal conviction?	A brother should not place a stumbling block or a snare for another brother on issues of personal conviction.
14:14	ny9h				Paul is persuaded in the Lord Jesus that which foods are unclean?	Paul is persuaded that no foods are unclean.
14:17	qml4				About what is the kingdom of God?	The kingdom of God is about righteousness, peace, and joy in the Holy Spirit.
14:21	n5jz				What does Paul say a brother should do in the presence of another brother who does not eat meat or drink wine?	Paul says it is good if the brother does not eat meat or drink wine in the presence of the other brother.
14:23	de9p				What is the result if a person does not act from faith?	Whatever actions are not taken from faith are sin.
15:1-2	fcej				What attitude should believers with strong faith have toward those with weak faith?	Believers with strong faith should bear the weaknesses of those with weak faith, in order to build them up.
15:3	lf9u				Who is the example Paul uses of one who did not live to please himself, but served others?	Christ did not live to please himself, but served others.
15:4	zng5				What was one of the purposes of the Scriptures written previously?	The Scriptures written previously were written for our instruction.
15:5	vxth				What does Paul desire for the believers through their exercise of patience and encouragement with each other?	Paul desires that the believers be of the same mind with each other.
15:8-9	yvbx				Who is the example Paul uses of one who lived to serve others?	Christ lived to served others.
15:10-11	vm8x				What do the scriptures say the Gentiles will do because of God’s mercy toward them?	The scriptures say the Gentiles will rejoice and praise the Lord.
15:13	xh71				What does Paul say the believers will be able to do by the power of the Holy Spirit?	The believers will be filled with joy and peace, and will abound in hope.
15:16	ixwn				What gift did God give Paul, which is Paul’s mission?	Paul’s mission is to be a servant of Christ Jesus sent to the Gentiles.
15:18-19	zfi6				By what means has Christ worked through Paul to bring about the obedience of the Gentiles?	Christ has worked through Paul by word and action, by the power of signs and wonders, and by the power of the Holy Spirit.
15:20-21	x6qt				Where does Paul desire to proclaim the gospel?	Paul desires to proclaim the gospel where Christ is not known by name.
15:24	j228				Where does Paul plan to travel that will also allow him to come to Rome?	Paul plans to travel to Spain, which will also allow him to come to Rome.
15:25	ddu2				Why is Paul now going to Jerusalem?	Paul is now going to Jerusalem to serve the believers there.
15:27	et47				Why does Paul say the Gentile believers owe the Jewish believers material things?	The Gentiles believers owe the Jewish believers material things because the Gentile believers have shared in the spiritual things of the Jewish believers.
15:31	cpd5				From whom does Paul wish to be delivered?	Paul wishes to be delivered from those who are disobedient in Judea.
16:1-2	rsvb				What has sister Phoebe become to Paul?	Sister Phoebe has become a helper of Paul and of many others.
16:4	n5ot				What have Prisca and Aquila done for Paul in the past?	Prisca and Aquila have risked their lives for Paul in the past.
16:5	tcol				Where is one place the believers are meeting in Rome?	The believers in Rome are meeting in the house of Prisca and Aquila.
16:7	n2mh				What experience have Andronicus and Junias shared with Paul in the past?	Andronicus and Junias have been fellow prisoners with Paul in the past.
16:16	b9cm				How do the believers greet one another?	The believers greet one another with a holy kiss.
16:17	vhi8				What does Paul tell the believers to do with those causing divisions and stumbling?	Paul tells the believers to turn away from those causing divisions and stumbling.
16:17-18	wc3g				What are some doing, which is causing divisions and stumbling?	Some are going beyond the teaching they have learned, deceiving the hearts of the innocent.
16:19	zpcj				What attitude does Paul want the believers to have toward good and evil?	Paul wants the believers to be wise to that which is good, and innocent to that which is evil.
16:20	m8ao				What will the God of peace be doing soon?	The God of peace will soon be crushing Satan under the believers’ feet.
16:22	r2s9				Who actually wrote down this epistle?	Tertius actually wrote down this epistle.
16:23	fcfz				What occupation does the believer Erastus have?	Erastus is the treasurer of the city.
16:25-26	qjzq				What revelation that had been kept secret from long ago is Paul now preaching?	Paul is now preaching the revelation of the gospel of Jesus Christ.
16:26	d7on				For what purpose is Paul preaching?	Paul is preaching for the obedience of faith among all the Gentiles.
